id,year,paper,question_no,question_text,word_limit,marks,topic_hint,source_url
1,2022-2023,Indian Polity & Governance Notes,1,"This Act was passed by the Parliament to reform the age-old Indian Penal Code (1860), the principal law on criminal offences in India. Introduced new offences: y Terrorism: An act that intends to threaten the unity, integrity, security or economic security of the country, or strike terror in the people. y Mob lynching: Murder by a group of five or more persons on grounds of certain identity markers such as caste, language or personal belief will be an offence with penalty life imprisonment or death, and with a fine. y Organized crimes: Includes crimes such as kidnapping, extortion and cyber-crime committed on behalf of a crime syndicate. y It adds community service as a form of punishment. Important Modifications: y Sedition is no longer an offence. Instead, there is a new offence for acts endangering the sovereignty, unity and integrity of India. y It criminalizes sexual intercourse with a woman by deceitful means or making false promises. y It elevates punishments for causing death b...",,,"The Bharatiya Nyaya (Second) Sanhita, 2023",file:///Users/harshvardhanjha/upsc-news-digest/docs/Polity-PT730_v3.pdf
2,2022-2023,Indian Polity & Governance Notes,2,"The Bharatiya Nagarik Suraksha (Second) Sanhita, 2023 (BNSS2) seeks to replace the Criminal Procedure Code, 1973 (CrPC), which provides for the procedure for arrest, prosecution, and bail. Key Provisions: y Forensic investigation: Mandates forensic investigation for offences punishable with seven years of imprisonment or more. y Use of Technology: All trials, inquiries, and proceedings may be held in electronic mode. y Hierarchy of Courts: It removes the classification of metropolitan areas and Metropolitan Magistrates. y Evasion from Trial: If a proclaimed offender has absconded to evade trial and there is no immediate prospect of arresting him, the trial can be conducted and judgement pronounced in his absence. y The CrPC provides for bail for an accused who has been detained for half the maximum imprisonment for the offence. The BNSS denies this facility for anyone facing multiple charges. As many cases involve charges under multiple sections, this may limit such bail....",,,"The Bharatiya Nagarik Suraksha (Second) Sanhita, 2023",file:///Users/harshvardhanjha/upsc-news-digest/docs/Polity-PT730_v3.pdf
3,2022-2023,Indian Polity & Governance Notes,3,"It replaces the Indian Evidence Act, 1872 (IEA), which governs the admissibility of evidence in Indian Courts and applies to all civil and criminal proceedings. It retains most provisions of the IEA including those on confessions, relevancy of facts, and burden of proof. Key Provisions/Changes: y The IEA provides for two kinds of evidence - documentary and oral. Documentary evidence includes primary (original documents) and secondary (that proves the contents of the original). The BSB2 retains the distinction. It classifies electronic records as documents. y Under the IEA, electronic records are categorised as secondary evidence. The BSB2 classifies electronic records as primary evidence. It expands such records to include information stored in semiconductor memory or any communication devices (smartphones, laptops). y The BSB2 expands secondary evidence to include: (i) oral and written admissions, and (ii) the testimony of a person who has examined the document and is skilled in the e...",,,"Bharatiya Sakshya (Second) Act, 2023",file:///Users/harshvardhanjha/upsc-news-digest/docs/Polity-PT730_v3.pdf
4,2022-2023,Indian Polity & Governance Notes,4,"West Bengal and Jharkhand Government is seeking recognition of Sarna religious code for tribals. Sarna Code: y Sarna followers are nature worshippers who do not consider themselves Hindus and have been fighting for a separate religious identity for decades y The holy grail of the Sarna faith is “Jal (water), Jungle (forest), Zameen (land).” y Its followers pray to the trees and hills while believing in protecting the forest areas. y Believers of the Sarna faith do not practice idol worship, nor do they adhere to the concept of the Varna system, heaven-hell, etc. y They are concentrated mainly in the tribal belt states of Odisha, Jharkhand, Bihar, West Bengal, and Assam. y Several surveys and reports have indicated that over 50 lakh tribal people in the entire country put their religion as ‘Sarna’ in the 2011 census, although it was not a code....",,,Sarna Code,file:///Users/harshvardhanjha/upsc-news-digest/docs/Polity-PT730_v3.pdf
5,2022-2023,Indian Polity & Governance Notes,5,"The Delhi High Court passed an interim order protecting the personality rights of Bollywood actor Anil Kapoor. The judgement restrained various entities from misusing his image, name, voice or other elements of his persona for monetary gains without his consent....",,,Personality Rights,file:///Users/harshvardhanjha/upsc-news-digest/docs/Polity-PT730_v3.pdf
6,2022-2023,Indian Polity & Governance Notes,6,"The recently passed Criminal Procedure (Identification) Act 2022 has come into force It repeals the existing Identification of Prisoners Act, 1920. The new law allows investigators to collect certain identifiable information of convicts and other persons for purposes of identification and investigation in criminal matters. Key provisions: y Legal sanction of data collection: It empowers police to collect fingerprints, palm prints and footprints, Photos, Iris and retina scans, behavioural attributes, etc. y Measurements and photographs for identification have three main purposes: to establish the identity of the culprit against the person being arrested, to identify suspected repetition of similar offences by the same person and to establish a previous conviction. y Persons in preventive detention: It also seeks to apply to persons detained under any preventive detention law. y It empowers the National Crime Records Bureau (NCRB) to store, preserve, share with any law enforcement agency...",,,"Craiminal Procedure (Identification) Act, 2022",file:///Users/harshvardhanjha/upsc-news-digest/docs/Polity-PT730_v3.pdf
7,2022-2023,Indian Polity & Governance Notes,7,The Election Commission of India (ECI) publishes final delimitation orders for Assembly & Parliamentary Constituencies of the State of Assam. Delimitation Commission: y It is a statutory body established by the Parliament under the Delimitation Commission Act. y It is a high-powered committee entrusted with the task of drawing and redrawing boundaries of different constituencies for state assembly and Lok Sabha election. y It is appointed by the President and works in collaboration with the Election Commission....,,,Delimitation Commission,file:///Users/harshvardhanjha/upsc-news-digest/docs/Polity-PT730_v3.pdf
8,2022-2023,Indian Polity & Governance Notes,8,"The Odisha state cabinet approved the inclusion of the Kui language in the eighth schedule of the Constitution of India. Inclusion of Kui in the eighth schedule will help in the preservation, promotion and propagation of the language and culture. 8th Schedule of the Indian Constitution: y It enlist the Official language of the Country and consists of 22 languages currently. The Indian constitution deals with the official languages in Articles 343 to 351. y 14 languages were originally listed in the Constitution and the rest were added over time. y Sindhi language was added by the 21st Amendment Act of 1967. y Konkani, Manipuri, and Nepali were included by the 71st Amendment Act of 1992. y Bodo, Dogri, Maithili, and Santhali were added by the 92nd Amendment Act of 2003 which came into force in 2004....",,,Kui language inclusion in 8th schedule gets approval of Odisha Government,file:///Users/harshvardhanjha/upsc-news-digest/docs/Polity-PT730_v3.pdf
9,2022-2023,Indian Polity & Governance Notes,9,"A bench of Justices of the Supreme Court has recently said that all accused have a right to silence and investigators cannot force them to speak up or admit guilt, emphasising that the Constitution accords every person a right against self-incrimination. Right to Silence y Right to silence emanates from Article 20(3), which states that no one can be compelled to be a witness against himself. y The provision gives an accused the right against self-incrimination -- a fundamental canon of law. y However, there are some limitations: ⚪ Protection is limited only to criminal proceedings. ⚪ Right is not available to a person being interrogated under Customs Act, 1962, or Foreign Exchange Management Act, 1999, since the person is not “accused of an offence” and isn’t entitled to a lawyer....",,,Right to Silence,file:///Users/harshvardhanjha/upsc-news-digest/docs/Polity-PT730_v3.pdf
10,2022-2023,Indian Polity & Governance Notes,10,y It is officially known as the National Commission for Religious and Linguistic Minorities. y It was constituted to look into various issues related to linguistic and religious minorities in the country. y Report by Commission (2007) recommended that Scheduled caste status be completely delinked from religion and be made religion neutral like STs. y It had recommended permitting Dalits who converted to Islam and Christianity to avail Scheduled Caste status....,,,Ranganath Mishra Commission,file:///Users/harshvardhanjha/upsc-news-digest/docs/Polity-PT730_v3.pdf
11,2022-2023,Indian Polity & Governance Notes,11,"The Government of National Capital Territory of Delhi (Amendment) Act, 2023 has recently passed by the Parliament, replacing the ordinance on control of services in Delhi. Key features of the Act: y Establishes the National Capital Civil Services Authority (NCCSA): It establishes NCCSA to make recommendations to the Lt. Governor on certain matters related to services, including transfers and postings, vigilance, disciplinary proceedings, and prosecution sanctions of Group A of All India Services (except Indian Police Service), and DANICS. ⚪ The Authority will consist of the: Chief Minister of Delhi as Chairperson, Principal Home Secretary of the Delhi government as Member Secretary, and Chief Secretary of the Delhi government as member. y Expands the powers of LG: It expands the discretionary role of the LG by giving him powers to approve the recommendations of the Authority, or return them for reconsideration. In the case of a difference of opinion between the LG and the Authority, th...",,,Unique Status of Delhi- Government of NCT of Delhi Amendment Act 2023,file:///Users/harshvardhanjha/upsc-news-digest/docs/Polity-PT730_v3.pdf
12,2022-2023,Indian Polity & Governance Notes,12,"Overseas Indian citizens will no longer need a new OCI card, as per the Ministry of Home Affairs (MHA). It is to be issued only after a new passport is issued in their names. When a person receives a new passport after turning 20, it only has to be given once more. Overseas Citizenship of India(OCI) y A person who has Indian ancestry but is legally a citizen of another nation is known as an overseas Indian citizen (OCI). y According to the Ministry of Home Affairs, a person who meets the requirements for an OCI must have been an Indian citizen on or after January 26, 1950, or have been qualified to do so on that day or be the child or grandchild of such a person. y OCI, or a mobility status, enables foreign nationals who are already residents of India to start living, studying, or working there. OCI Card y The OCI card was made possible by the Citizenship (Amendment) Act, which was approved in 2005. y It was approved to meet the demands of Indians who live in other developed countries ...",,,Overseas Citizens of India (OCI),file:///Users/harshvardhanjha/upsc-news-digest/docs/Polity-PT730_v3.pdf
13,2022-2023,Indian Polity & Governance Notes,13,"Punjab has become the first state to implement the ‘right to walk’. y Right to walk makes it mandatory for all road-owning agencies, including the NHAI, to provide footpaths and cycle tracks on the road. y It seeks ‘RIght to Walk’ under Article 21 of the Indian Constitution by ensuring safe facilities for pedestrians. Rights of Pedestrians y In the all-India context, there is no central level legislation or policy governing or enforcing the rights of pedestrians. y The new Motor Vehicles Act and few other legislations have some provisions but do not talk exclusively about the rights of pedestrians. y The Indian Penal Code (IPC) enforces strict punishment in cases of rash or negligent driving, endangering someone else’s life or personal safety, etc. But none of these acts takes forward the concept of “right to walk”. y The “right to walk” concept can only be found as a small reference in the Rules of Road Regulation 1989: Rule number 8 (the duty of the driver to slow down when approachi...",,,Right to Walk,file:///Users/harshvardhanjha/upsc-news-digest/docs/Polity-PT730_v3.pdf
14,2022-2023,Indian Polity & Governance Notes,14,"Based on the Ethics Committee Report, the Lok Sabha has recently expelled one of its members accused of accepting gifts and illegal gratification. Basis of Expulsion: y The constitutional basis of expulsion: An MP found guilty of breach of privileges or contempt of the house can be suspended from the house or face expulsion. ⚪ A simple majority is needed to pass a motion for expulsion in each house. ⚪ Further involvement of the Ethics committee is not always necessary for expulsion. y Legal basis of suspension and expulsions of MPs: To ensure smooth proceedings and maintain order, the Presiding Officer of the House has the power to force a Member to withdraw from the House. ⚪ In cases of extreme misconduct, the House may expel a member “to rid the House of persons who are unfit for membership.”...",,,Expulsion of Members of Parliament (MPs) in India,file:///Users/harshvardhanjha/upsc-news-digest/docs/Polity-PT730_v3.pdf
15,2022-2023,Indian Polity & Governance Notes,15,y It consists of not more than 15 Members nominated by the Speaker and shall hold office for a term not exceeding one year. y The functions of the Ethics Committee are: ⚪ Examine a complaint relating to the unethical conduct of a member referred to it by the Speaker. ⚪ Make recommendations and formulate a code of conduct for Members. ⚪ Suggest amendments to the code of conduct. y The First Ethics Committee of Lok Sabha was set up in 2000 and of Rajya sabha in 1997....,,,Ethics Committee of Lok Sabha,file:///Users/harshvardhanjha/upsc-news-digest/docs/Polity-PT730_v3.pdf
16,2022-2023,Indian Polity & Governance Notes,16,"Recently, a Supreme Court judge has been nominated as the Chairman of the SCLSC. Supreme Court Legal Services Committee (SCLSC) y It is a statutory body. y It is constituted under section 3A of Legal Services Authorities Act, 1987 by National Legal Service Authority. y Objective: Providing free legal services to poor, under-privileged and those marginalized in society. Chief Justice of India in Patron- in-Chief of Committee. y Members: Chairman (sitting Judge of SC) and 9 members (nominated by the Chief Justice of India)....",,,Supreme Court Legal Services Committee (SCLSC),file:///Users/harshvardhanjha/upsc-news-digest/docs/Polity-PT730_v3.pdf
17,2022-2023,Indian Polity & Governance Notes,17,"The launch of the e-SAKSHI mobile application marks a significant advancement in the administration of the Member of Parliament Local Area Development Scheme (MPLADS) in India. y MPLADS (Member of Parliament Local Area Development Scheme (MPLADS) e-SAKSHI Mobile Application was launched by the Ministry of Statistics and Programme Implementation (MoSPI). y It offers convenience and accessibility, allowing MPs to propose, track, and oversee the projects in real-time, which enhances decision-making processes, enabling swift responses to emerging needs or issues. MPLADS: y It is a Central Sector Scheme under MoSPI. y MPLADS funds used for creation of durable community assets in areas of drinking water, primary education, etc. y Atleast 15 percent of MPLADS entitlement is allocated for areas inhabited by Scheduled Caste population and 7.5 percent for areas inhabited by ST population. y Funds are non-lapsable i.e. if money is not utilised, it gets carried to next year. y District authority m...",,,MPLADS e-SAKSHI Mobile Application,file:///Users/harshvardhanjha/upsc-news-digest/docs/Polity-PT730_v3.pdf
18,2022-2023,Indian Polity & Governance Notes,18,"Recently, the 1st meeting of the Social Audit Advisory Body (SAAB) was concluded in New Delhi. About SAAB: y This pioneering advisory body aims to guide the Ministry of Social Justice & Empowerment in the institutionalization of social audits across its diverse schemes. y It is set up in the National Institute of Social Defence (NISD), which function under the Department of Social Justice & Empowerment (DoSJE), Ministry of Social Justice and Empowerment. About Social Audit y The term ‘Social Audit’ was proposed by Howard Bowen in his 1953 book Social Responsibilities of the Businessman. y Social Audit is a process of examination and assessment of a programme/scheme. y The Key guiding principles of Social Audit: Access to information (Jaankari); Participation (Bhagidari); Protection of citizens (Suraksha); etc. Important fact: In India, Tata Iron and Steel Company Limited (TISCO), Jamshedpur, was the first company to perform social audits in 1979 for measuring its social performance. Ma...",,,Social Audit Advisory Board (SAAB),file:///Users/harshvardhanjha/upsc-news-digest/docs/Polity-PT730_v3.pdf
19,2022-2023,Indian Polity & Governance Notes,19,"There have been demands from many state governments to revisit the Seventh Schedule to improve Centre-state relations. Seventh Schedule y Seventh Schedule under Article 246 provides distribution of powers and responsibilities between state and central governments. y It specifies roles and responsibilities into three lists namely, Union List, State List and Concurrent List. y The entries that are related to national importance were allocated to the Union and entries of local concern were allocated to the States. y Article 248 confers residuary powers on Parliament. Residuary powers refer to power of jurisdiction upon subjects that are not mentioned in state or concurrent list. Procedure for amending Seventh schedule y It can be amended as provided under Article 368 in Part XX of the Constitution. y It requires special majority of Parliament (majority of total membership of House and by a majority of not less than two-thirds of members of House present and voting) and also consent of hal...",,,Seventh Schedule of the Indian Constitution,file:///Users/harshvardhanjha/upsc-news-digest/docs/Polity-PT730_v3.pdf
20,2022-2023,Indian Polity & Governance Notes,20,"Unresolved issue of Satluj Yamuna Link Canal as Haryana and Punjab have failed to reach any settlement over water- sharing of Ravi and Beas rivers. About Sutlej-Yamuna Link Canal y The 214-kilometer-long canal connecting Sutlej and Yamuna rivers was proposed in 1966 after the state of Haryana was formed out of Punjab. y Aim: Provide Haryana its average annual share of surplus Ravi- Beas water. y Issue: Haryana completed its stretch of SYL Canal in 1980, while Punjab kept citing Riparian Principles and non-availability of its Water. ⚪ Riparian Principles state that the owner of land adjacent to a water body has the right to use water. y Haryana argues that its southern parts of state are facing water problems due to depleted groundwater. Haryana has been denied its rightful share in water as assessed by Eradi Tribunal, 1987. Constitutional Provisions: y Entry 56 of the Union List empowers the Union Government for the regulation and development of inter-state rivers and river valleys to ...",,,Inter-state river disputes (Satluj- Yamuna Link Canal),file:///Users/harshvardhanjha/upsc-news-digest/docs/Polity-PT730_v3.pdf
21,2022-2023,Indian Polity & Governance Notes,21,"The Central government had increased the borrowing limits for states from 3% of the GSDP (Gross State Domestic Product) to 5%. y Out of 5%, 1% raise was linked to showing progress on four sets of reform measures linked to: ⚪ One nation one ration card ⚪ Ease of doing business, ⚪ Power distribution ⚪ Urban local body revenues. y This policy incentivises the states to adopt progressive policies to avail additional funds. Constitutional Provisions: y Article 293 of the Indian Constitution deals with borrowing Powers of States. y It gives states the executive power to borrow money within the limits that the state legislature sets. y Also, the Central Government can give loans and guarantees to states. y If a state already has loans from the Centre, the Centre needs to give its consent before the state can borrow more, and the Centre can add conditions to that permission....",,,Borrowing powers of State govt,file:///Users/harshvardhanjha/upsc-news-digest/docs/Polity-PT730_v3.pdf
22,2022-2023,Indian Polity & Governance Notes,22,"Recently, parts of the leader of the opposition speech on motion of thanks on the President’s Address were expunged. Experts cited that this is against the Parliamentary Privileges of MP enjoyed under Article 105 of the Constitution. Parliamentary Privileges y Parliamentary privileges are a legal immunity enjoyed by members of legislatures, wherein the legislators are granted protection against civil or criminal liability for certain actions done or statements made in the course of their legislative duties. y Parliament is the sole authority to ascertain if there has been a breach of privilege or contempt of House...",,,Parliamentary privileges,file:///Users/harshvardhanjha/upsc-news-digest/docs/Polity-PT730_v3.pdf
23,2022-2023,Indian Polity & Governance Notes,23,"A panel has presented its recommendations to Chairman regarding increasing Tenure of House Committees in a comprehensive study of Rajya Sabha Secretariat Parliamentary Committees y It is a panel of MPs that is appointed or elected by the House or nominated by the Speaker, and which works under direction of the Speaker. y The Parliamentary Committees present its report to the House or to the Speaker. y PCs have their origins in the British Parliament. ⚪ They draw their authority from Article 105 which deals with privileges of MPs, and Article 118 which gives Parliament authority to make rules to regulate its procedure and conduct of business. ⚪ Parliament is not bound by recommendations of committees....",,,Parliamentary Committees,file:///Users/harshvardhanjha/upsc-news-digest/docs/Polity-PT730_v3.pdf
24,2022-2023,Indian Polity & Governance Notes,24,"Advocate Prashant Bhushan argued that instead of implementing the new recruitment scheme, the government should complete the old process and cited the doctrine of promissory estoppel. About Doctrine of Promissory Estoppel y Promissory estoppel is a concept developed in contractual laws. It prevents a “promisor” from backing out of an agreement on the grounds that there is no “consideration”. y It is invoked by a plaintiff to ensure execution of a contract or seek compensation for failure to perform the contract. y The Supreme Court pointed out that “promissory estoppel is always subject to overarching public interest”....",,,Doctrine of Promissory Estopper,file:///Users/harshvardhanjha/upsc-news-digest/docs/Polity-PT730_v3.pdf
25,2022-2023,Indian Polity & Governance Notes,25,"The President gave the assent to Election Laws (Amendment) Act, 2021. It amends Representation of People Act, 1950 (RPA, 1950) and Representation of People Act, 1951 (RPA, 1951) to implement certain electoral reforms. Key Provisions: y Linking electoral roll data with Aadhaar (by amendment of section 23 of RPA, 1950). ⚪ Electoral registration officer may require a person to furnish their Aadhaar number for establishing their identity....",,,Election Laws (Amendment) Act 2021,file:///Users/harshvardhanjha/upsc-news-digest/docs/Polity-PT730_v3.pdf
26,2022-2023,Indian Polity & Governance Notes,26,"y The Nordic (Scandinavian) Model of Social Democracy is in discussion due to recent Sweden elections. y The Nordic model of social democracy is a combination of social welfare and economic systems adopted by Nordic countries (Sweden, Norway, Finland, Denmark, and Iceland)....",,,Social Democracy,file:///Users/harshvardhanjha/upsc-news-digest/docs/Polity-PT730_v3.pdf
27,2022-2023,Indian Polity & Governance Notes,27,"y Electoral literacy refers to the knowledge and understanding of the electoral process, including the rights and responsibilities of citizens in a democratic system. y It encompasses the ability of individuals to make informed and meaningful choices in elections, participate in the electoral process, and understand the significance of voting in a democracy. y Electoral literacy is essential for ensuring a well-informed and engaged citizenry....",,,Electoral Literacy,file:///Users/harshvardhanjha/upsc-news-digest/docs/Polity-PT730_v3.pdf
28,2022-2023,Indian Polity & Governance Notes,28,"y There has been discussion in the Parliament and in the Ministerial level on amending the Representation of the People Act, 1951 to enable a common electoral roll and simultaneous elections to all electoral bodies in the country. Common electoral roll y Under the Common Electoral Roll, only one voter list will be used for Lok Sabha, Vidhan Sabha and other elections. y The types of electoral rolls in different states are different: ⚪ Some state laws allow the SEC (State Election Commission) to borrow and use the Election Commission of India’s voter’s rolls for the local body elections. ⚪ In others, the state commission uses the EC’s voters list as the basis for the preparation and revision of rolls for municipality and panchayat elections....",,,Common Electoral Roll,file:///Users/harshvardhanjha/upsc-news-digest/docs/Polity-PT730_v3.pdf
