id,year,paper,question_no,question_text,word_limit,marks,topic_hint,source_url
29,2022-2023,Indian Polity & Governance Notes,29,"Recently, the Press and Registration of Periodicals Act, 2023, was passed in the Lok Sabha that seeks to repeal the Press and Registration of Books Act, 1867. Objective: The 1867 Act exercised complete control over the press and the printers and publishers of newspapers and books along with heavy fines and penalties including imprisonment for various violations. Important Provisions: y Press Registrar General (PRG): It creates a new position of Press Registrar General, who is entrusted with tasks like- issuing certificates of registration to periodicals, disbursing the Centre’s funds for the Act’s implementation, etc. y Introduced a simple online registration mechanism y Reduced role of District magistrate/local authority. y Facsimile edition of a foreign periodical: Foreign periodicals can be printed in India with prior approval of the Central Government and its registration with the Press Registrar General (PRG). y Suspension: It allows the PRG to suspend a periodical’s registration ...",,,"Registration of Press and Periodicals Act, 2023",file:///Users/harshvardhanjha/upsc-news-digest/docs/Polity-PT730_v3.pdf
30,2022-2023,Indian Polity & Governance Notes,30,"Special Category Status (SCS) y SCS, first introduced in 1969, is a classification given by the Centre to assist in the development of those states that face geographical and socio-economic disadvantages like hilly terrains, strategic international borders, economic and infrastructural backwardness, and non-viable state finances. y Under SCS, the Central government bears 90% of the state expenditure on all centrally-sponsored schemes and external aid while the rest 10% is given as loan to the state at zero percent rate of interest. ⚪ Unspent money does not lapse and is carried forward. ⚪ States with SCS are exempted from customs duty, corporate tax, income tax and other taxes to attract investment....",,,Special Category Status,file:///Users/harshvardhanjha/upsc-news-digest/docs/Polity-PT730_v3.pdf
31,2022-2023,Indian Polity & Governance Notes,31,"The Amendment seeks to provide 33 per cent reservation to women in the Lok Sabha and state Assemblies. About the 106th Amendment: y It reserves one-third of all seats for women in Lok Sabha, state legislative assemblies, and the Legislative Assembly of the National Capital Territory of Delhi....",,,"Nari Shakti Vandana (106th Amendment Act, 2023",file:///Users/harshvardhanjha/upsc-news-digest/docs/Polity-PT730_v3.pdf
32,2022-2023,Indian Polity & Governance Notes,32,"y Mission Karmayogi’ - the National Programme for Civil Services Capacity Building (NPCSCB) aims to transform capacity-building in the bureaucracy through institutional and process reforms. y The capacity building programme will be delivered through an Integrated Government Online Training or iGOT-Karmayogi digital platform, with content drawn from global best practices rooted in Indian national ethos. y iGOT-Karmayogi digital platform is a portal on the Ministry of Education’s DIKSHA platform for the purpose of capacity building....",,,Mission Karmayogi,file:///Users/harshvardhanjha/upsc-news-digest/docs/Polity-PT730_v3.pdf
33,2022-2023,Indian Polity & Governance Notes,33,"The European Commission proposed a set of digital rights and principles recently, as an extension of the Berlin Declaration on Digital Society and Value-based Governance. Digital Rights y Digital Rights are an extension of the rights set in the UN Declaration of Human Rights y They are linked with right of people that allow them to access, use, create and publish digital media....",,,Digital Rights,file:///Users/harshvardhanjha/upsc-news-digest/docs/Polity-PT730_v3.pdf
34,2022-2023,Indian Polity & Governance Notes,34,"Recently, the Department of Expenditure under the Ministry of Finance released guidelines for reforms in Public Procurement and Project Management. y Public Procurement and Project Management includes the procurement of goods and services by public entities and execution of different projects. E.g., the goods or services purchased by government entities for public service delivery. y These guidelines have been prepared under the aegis of Central Vigilance Commission (CVC). y Public procurement allows governments and state-owned enterprises to purchase goods and services from the private sector. y It is necessary to counteract the tendency of mismanagement, as the share of public procurement is estimated to be between 20% and 30% of gross domestic product (GDP)....",,,Public Procurement and Project Management,file:///Users/harshvardhanjha/upsc-news-digest/docs/Polity-PT730_v3.pdf
35,2022-2023,Indian Polity & Governance Notes,35,"Recently, the Ministry of Law and Justice has created the Nyaya Vikas Portal for monitoring the implementation of Centrally Sponsored Schemes (CSS) for development of Infrastructure for Judiciary. About Nyaya Vikas Portal y Nyaya Vikas Portal allows efficient ways of logging into the portal, thereby empowering stakeholders with seamless access to information pertaining to funding, documentation, project monitoring and approval....",,,Nyaya Vikas Portal,file:///Users/harshvardhanjha/upsc-news-digest/docs/Polity-PT730_v3.pdf
36,2022-2023,Indian Polity & Governance Notes,36,"The Indian Parliament has passed the Cinematograph (Amendment) Act, 2023 which amends the Cinematograph Act, 1952. Key Features of the Act: y It constitutes the Board of Film Certification for certifying films for exhibition. y It adds certain additional certificate categories based on age. Under the Act, film may be certified for exhibition: ⚪ without restriction (‘U’) ⚪ without restriction, but subject to guidance of parents or guardians for children below 12 years of age (‘UA’) ⚪ only to adults (‘A’), or only to members of any profession or class of persons (‘S’). y It prohibits carrying out or abetting: the unauthorised recording and unauthorised exhibition of films. y It made provisions to penalize film piracy with jail term and fine. y Provisions to grant certificates to films for perpetuity. Currently, certificates issued are valid only for 10 years....",,,Curbing Film Privacy,file:///Users/harshvardhanjha/upsc-news-digest/docs/Polity-PT730_v3.pdf
37,2022-2023,Indian Polity & Governance Notes,37,"The Union Cabinet approved continuation of the Fast Track Special Courts (FTSCs) Scheme until March 31, 2026. About Fast Track Special Courts (FTSCs) y Launched in 2019, FSTCs is a Centrally Sponsored Scheme and implemented by the Department of Justice, Ministry of Law & Justice. y Central Share is to be funded from Nirbhaya Fund, aimed at enhancing the safety and security for women. y FTSCs, designed as dedicated courts, were established for hearing rape and Protection of Children from Sexual Offences Act (POCSO Act) cases. y Enactment of Criminal Law (Amendment) Act 2018, which included stringent punishment, including death penalty for rape offenders, led to the creation of FTSCs. y FTSCs are linked to National Judicial Data Grid...",,,Fast Track Special Courts (FTSCs),file:///Users/harshvardhanjha/upsc-news-digest/docs/Polity-PT730_v3.pdf
38,2022-2023,Indian Polity & Governance Notes,38,"Delegated Legislation y It is the process of law-making by an executive or administrative authority under the powers conferred upon it by the legislature. y This concept of delegated legislation is not mentioned specifically in the Indian Constitution but it can be interpreted by Article 312 of the given Constitution. y A 1973 Supreme Court ruling explains delegated legislation as: “Empowering the Executive to make subordinate legislation within a prescribed sphere has evolved out of practical necessity and pragmatic needs of a modern welfare State” Case Laws related to Delegated Legislation: y DS Grewal vs State of Punjab: The Court held that delegated legislation must be made for a specific purpose and must not be arbitrary or discriminatory. y Indian Express Newspapers (Bombay) Private Ltd. v. Union of India: This case dealt with the validity of the Customs Act, 1962, which gave the government the power to make rules for the assessment and collection of customs duties. The Supreme C...",,,Delegated Legislation,file:///Users/harshvardhanjha/upsc-news-digest/docs/Polity-PT730_v3.pdf
39,2022-2023,Indian Polity & Governance Notes,39,"y AoRs are a pool of lawyers whose legal practice is mostly before the Supreme Court. y They are lawyers in the Indian legal system who are registered and authorized by the Supreme Court (SC) to represent clients in that court. y The SC in the exercise of its rule-making power under Article 145, made a provision for the AoR system. y Supreme Court Rules, 2013 prescribe eligibility criteria for an AoR. ⚪ Only AoR is entitled to file any matter or document before the SC. ⚪ Senior Advocate is not entitled to appear without AoR in SC....",,,Advocate-on- Record (AoR),file:///Users/harshvardhanjha/upsc-news-digest/docs/Polity-PT730_v3.pdf
40,2022-2023,Indian Polity & Governance Notes,40,"During her inaugural address at the Supreme Court’s Constitution Day celebration on Sunday (November 26), President Droupadi Murmu called for an “all-India judicial service” to recruit judges. All India Judicial Services (AIJS) y AIJS is a centralized recruitment system for judges at the level of additional district judges and district judges across all states. y It aims to centralize the recruitment of judges, similar to the Union Public Service Commission (UPSC) model, assigning successful candidates to states. y Originating from Law Commission reports in 1958 and 1978, AIJS seeks to address structural issues like varying pay, faster vacancy filling, and standardized nationwide training....",,,All India Judicial Services (AIJS),file:///Users/harshvardhanjha/upsc-news-digest/docs/Polity-PT730_v3.pdf
41,2022-2023,Indian Polity & Governance Notes,41,"y The No-Confidence Motion is the mechanism to test the government’s majority as prescribed by the Constitution. y The Article 75(3) of the Constitution says the Council of Ministers is collectively responsible to the Lok Sabha. To test the collective responsibility of the MPs, the Lok Sabha allows the Motion of No- confidence, which is also called the Vote of No Confidence. y The procedure of No-confidence motion is specified under Rule 198 of the Lok Sabha. y The Constitution does not mention either a Confidence or a No Confidence Motion. y Any Lok Sabha MP, who can garner the support of 50 colleagues, can, at any point of time, introduce a motion of no-confidence against the Council of Ministers. y A no-confidence motion can be moved only in the Lok Sabha. It cannot be moved in the Rajya Sabha. y If the government wins the vote on the no-confidence motion, the motion is defeated and the government remains in power. y Till now, there have been 27 no-confidence motions introduced in t...",,,No-confidence motion,file:///Users/harshvardhanjha/upsc-news-digest/docs/Polity-PT730_v3.pdf
42,2022-2023,Indian Polity & Governance Notes,42,"According to the Election Commission, any of these three conditions need to be met if a party is to be called a “national party”. y A party’s candidates in a minimum of four states must get at least 6 per cent of the total votes polled in each of those states in the last national election. In addition to this, it should have won four seats in the Lok Sabha. y A party should win a minimum of 2 percent of the total seats in the Lok Sabha. The party’s candidates should have been elected from not less than three states. y A party is recognised as a “state party” in at least four states. Benefits under the RPA 1951: y It is entitled to exclusive allotment of its reserved symbol to the candidates throughout India (for the national party) in the State in which it is so recognised (for the state party). y Need only one proposer for filing the nomination and are also entitled to two sets of electoral rolls free of cost at the time of revision of rolls. y Their candidates get one copy of the ele...",,,National Party Status,file:///Users/harshvardhanjha/upsc-news-digest/docs/Polity-PT730_v3.pdf
43,2022-2023,Indian Polity & Governance Notes,43,"UIDAI y It is a Statutory authority established under the provisions of the Aadhaar Act 2016. y It functions under the Ministry of Electronics & Information Technology. y The role of the authority is to issue Unique Identification Numbers (UID), often referred to as ‘Aadhaar number’ to all the residents of India. ( Note: It is not limited to the Citizens of India) y Composition: UIDAI consists of a Chairperson, two part-time Members and the Chief Executive Officer (CEO), who is also the Member-Secretary of the Authority. About Aadhar: y It is a 12-digit individual identification number issued by the UIDAI to the residents of India after a certain verification process. y It serves as proof of identity and proof of address for residents of India. y This number is unique for each individual and will remain valid for a lifetime....",,,Unique Identification Authority of India (UIDAI),file:///Users/harshvardhanjha/upsc-news-digest/docs/Polity-PT730_v3.pdf
44,2022-2023,Indian Polity & Governance Notes,44,"Recently, the Information Commissioner, Heeralal Samariya, was sworn in as the chief of the Central Information Commission (CIC) by the President Of India. Central Information Commission: y Constituted under the Right to Information Act, 2005. y Jurisdiction: Extends over all Central Public Authorities. y Objectives: Exercise the powers conferred on them under the RTI Act, 2005. ⚪ Receive and inquire into complaints from any citizen (Section 18 of the RTI Act, 2005). ⚪ Receive and decide upon the second appeal from any citizen (Section 19 of the RTI Act, 2005). ⚪ Perform the duty of “Monitoring and Reporting “(Section 25 of the RTI Act, 2005). y Composition: It has a Chief Information Commissioner and not more than ten Information Commissioners. y Appointment: Appointed by the President of India on the recommendation of a committee consisting of the Prime Minister as Chairperson, the Leader of Opposition in the Lok Sabha, and a Union Cabinet Minister nominated by the Prime Minister. y ...",,,Central Information Commission,file:///Users/harshvardhanjha/upsc-news-digest/docs/Polity-PT730_v3.pdf
45,2022-2023,Indian Polity & Governance Notes,45,"Goods and Services Tax (GST) Council accepted the Group of Ministers’ (GoM) recommendations on long pending constitution of GST appellate tribunal in the country GST Appellate Tribunal (GSTAT): y The Central Goods and Service Tax Act, 2017 (CGST Act) in Section 109 mandates for the constitution of a GSTAT and its Benches. y It will be the specialized appellate authority for resolving disputes under the GST laws. Composition: y The tribunal will have one principal bench in New Delhi and as many benches or boards in states as decided by each state, subject to approval of the council. y North-eastern states could opt for one bench for 2-3 states and an additional bench for very far-flung areas. y The principal bench and state boards would have two technical and two judicial members each, with equal representation from the Centre and states. y All 4 members would not sit for hearing each case. This will depend upon the threshold or value of dues involved....",,,GST Appellate Tribunal,file:///Users/harshvardhanjha/upsc-news-digest/docs/Polity-PT730_v3.pdf
46,2022-2023,Indian Polity & Governance Notes,46,"y A star campaigner is a celebrity vote seeker in an election for a party. This person can be anyone, a politician or even a film star. y They are nominated by political parties to campaign in each set of constituencies for a specified duration. y There is no law governing who can or cannot be made a star campaigner. y List of star campaigners must be communicated to Chief Electoral Officer and ECI within a week from election notification date under section 77(1) of Representation of People Act (RPA), 1951. y Recognised political parties can have 40 Star campaigners and an unrecognized (but registered) political party can have 20....",,,Star Campaigners,file:///Users/harshvardhanjha/upsc-news-digest/docs/Polity-PT730_v3.pdf
47,2022-2023,Indian Polity & Governance Notes,47,"y Panchayats (Extension to Scheduled Areas) Act, 1996 focuses on protecting the principle of Jal, Jungle , Jameen (Water, forest and land) for the tribals. y The law enacted by the Government of India to cover the “Scheduled areas”, which are not covered in the 73rd amendment of Panchayati Raj Act of the Indian Constitution....",,,"Panchayats (Extension to Scheduled Areas) Act, 1996",file:///Users/harshvardhanjha/upsc-news-digest/docs/Polity-PT730_v3.pdf
48,2022-2023,Indian Polity & Governance Notes,48,The Comptroller and Auditor General of India (CAG) urges the government to adopt audit data standards. Lack of standardization in underlying data structures across government IT applications poses an audit challenge. About CAG: y CAG is the head of the Indian audit & account department and chief Guardian of Public purse. y CAG is an independent authority under the Constitution of India. y It is the institution through which the accountability of the government and other public authorities (all those who spend public funds) to Parliament and State Legislatures and through them to the people is ensured. y Shri Girish Chandra Murmu is the incumbent CAG of India....,,,Comptroller and Auditor General of India,file:///Users/harshvardhanjha/upsc-news-digest/docs/Polity-PT730_v3.pdf
49,2022-2023,Indian Polity & Governance Notes,49,"The Aspirational Blocks Programme is on the lines of the Aspirational District Programme that was launched in 2018 and covers 112 districts across the country. y This new programme is aimed at improving performance of blocks lagging on various development parameters. y This will enable holistic development in those areas that require added assistance. y Over half of these blocks are in 6 states—Uttar Pradesh (68 blocks), Bihar (61), Madhya Pradesh (42), Jharkhand (34), Odisha (29) and West Bengal (29). Aspirational Districts Programme It was launched in 2018 and aims to transform districts that have shown relatively lesser progress in key social areas. 3C Strategy: The broad contours of the programme y Convergence (of Central & State Schemes) y Collaboration (of Central, State level ‘Prabhari’ Officers & District Collectors) y Competition (among districts driven by a Mass Movement ) Parameters for Ranking: The ranking is based on the incremental progress made across 49 Key Performance ...",,,Aspirational District Programme,file:///Users/harshvardhanjha/upsc-news-digest/docs/Polity-PT730_v3.pdf
50,2022-2023,Indian Polity & Governance Notes,50,"Vibrant Villages Programme (VVP) has been announced in the Union Budget Speech 2022. y It aims at enhancing infrastructure in villages along India’s border with China, in states like Himachal Pradesh, Uttarakhand, and Arunachal Pradesh. y Activities under the VVP include building infrastructure such as housing, tourist centres, road connectivity, providing decentralized renewable energy, direct-to-home access for Doordarshan and educational channels, and support for livelihood generation. y The programme envisages coverage of border villages on the Northern border having sparse population, limited connectivity and infrastructure, which often get left out from the development gains. y Convergence of existing schemes is proposed under VVP. The villages on the Northern border to be covered under VVP are being finalized....",,,Vibrant Village Programme,file:///Users/harshvardhanjha/upsc-news-digest/docs/Polity-PT730_v3.pdf
51,2022-2023,Indian Polity & Governance Notes,51,"Uttarakhand became the first state in the country to implement a Uniform Civil Code (UCC). It enacted the UCC under the legislative powers of concurrent list having subjects of marriage, adoption and succession. About UCC: y UCC refers to codification of personal laws of various communities which apply to all citizens equally regardless of their religion, caste, community etc. y Currently, personal laws of various communities are governed by their religious scriptures. y Article 44 of the Indian constitution provides for enabling provision of Uniform Civil Code in India....",,,Uniform Civil Code,file:///Users/harshvardhanjha/upsc-news-digest/docs/Polity-PT730_v3.pdf
52,2022-2023,Indian Polity & Governance Notes,52,"The Enforcement Directorate has been heavily criticized by the opposition political parties in India as acting in partisan and biased manner. About the Directorate of Enforcement y First set up in 1956 as an ‘Enforcement unit’ under the administrative control of the Department of Economic Affairs, Ministry of Finance. y Renamed as Enforcement Directorate in 1956 and brought under the administrative control of Department of Revenue, Ministry of Finance in 1960. y For a short period of four years (1973 – 1977), the Enforcement Directorate remained under the administrative jurisdiction of the Department of Personnel & Administrative Reforms. But subsequently came under the administrative control of the Department of Revenue....",,,Directorate of Enforcement,file:///Users/harshvardhanjha/upsc-news-digest/docs/Polity-PT730_v3.pdf
53,2022-2023,Indian Polity & Governance Notes,53,"y The Bar Council of India is a statutory body created by Parliament under the Advocates Act of 1961 to regulate and represent the Indian Bar. y Attorney General and Solicitor General of India are ex-officio members of the Bar Council of India. Other members are elected from the state Bar Councils for 5 years. y Major Functions: ⚪ It performs the regulatory function by prescribing standards of professional conduct and etiquettes and by exercising disciplinary jurisdiction over the Bar. ⚪ It sets standards for legal education and grants recognition to Universities whose degree in law will serve as qualification for enrolment as an advocate. ⚪ It performs certain representative functions by protecting the rights, privileges and interests of advocates and through the creation of funds for providing financial assistance to organize welfare schemes for them....",,,Bar Council of India,file:///Users/harshvardhanjha/upsc-news-digest/docs/Polity-PT730_v3.pdf
54,2022-2023,Indian Polity & Governance Notes,54,"Lok Sabha Speaker Om Birla inaugurates 19th annual zone III conference of the Commonwealth Parliamentary Association India region at Gangtok. About the Commonwealth Parliamentary Association: y The Commonwealth Parliamentary Association (CPA) is one of the oldest established organizations in the Commonwealth, founded in 1911. y It is a membership association which brings together Members, irrespective of gender, race, religion or culture, who are united by community of interest, respect for the rule of law and individual rights and freedoms, and by the pursuit of the positive ideals of parliamentary democracy. y The Association is made up of over 180 Legislatures (or Branches) divided up between nine geographic regions of the Commonwealth. y It offers a vast opportunity for Parliamentarians and parliamentary staff to collaborate on issues of mutual interest and to share good practice....",,,Commonwealth Parliamentary Association,file:///Users/harshvardhanjha/upsc-news-digest/docs/Polity-PT730_v3.pdf
55,2022-2023,Indian Polity & Governance Notes,55,"y A whip is a written order that party members be present for an important vote, or that they vote only in a particular way. y Whip is used in parliamentary parlance often for floor management by political parties in the legislature....",,,Whip in India,file:///Users/harshvardhanjha/upsc-news-digest/docs/Polity-PT730_v3.pdf
