id,year,paper,question_no,question_text,word_limit,marks,topic_hint,source_url
552,2025,IEXP,552,"GDP (Graphs, Data, Perspectives): On the weakness of the Rupee",,,Explained Economics;Express Explained;Indian rupee,https://indianexpress.com/article/explained/explained-economics/gdp-graphs-data-perspectives-on-the-weakness-of-the-rupee-10272827/
553,2025,IEXP,553,"JSW’s takeover of Bhushan Power: Supreme Court’s reversal of its May decision, how it impacts ongoing IBC resolution plans",,,Explained Economics;Express Explained;Express Premium;JSW,https://indianexpress.com/article/explained/explained-economics/jsw-takeover-bhushan-power-sc-10273279/
554,2025,IEXP,554,"Corruption, ‘nepo babies’: How the Philippines’ protests echo Nepal agitation, where they diverge",,,Explained Global;Express Explained;Philippines,https://indianexpress.com/article/explained/explained-global/corruption-nepo-babies-philippines-youth-protest-10272365/
555,2025,IEXP,555,Why Denmark PM apologised for decades-long sterilisation campaign against Greenlandic women,,,Explained Global;Express Explained,https://indianexpress.com/article/explained/explained-global/denmark-pm-apology-sterilisation-campaign-greenland-women-10271003/
556,2025,IEXP,556,"After 6 years, Erdogan back at White House: What happened, why it matters",,,Explained Global;Express Explained,https://indianexpress.com/article/explained/explained-global/erdogan-back-at-white-house-what-why-matters-10272609/
557,2025,IEXP,557,"Explained Interview : ‘Trump sees China as economic rival, not in geopolitical sense…in this vision, India no longer enjoys priority’",,,Explained Global;Express Explained;Express Premium,https://indianexpress.com/article/explained/explained-global/interview-tellis-trump-china-economic-rival-geopolitical-india-10269244/
558,2025,IEXP,558,Chero Archers: Jharkhand archery team pays tribute to legendary warrior clan,,,Jharkhand,https://indianexpress.com/article/explained/explained-history/chero-archers-jharkhand-archery-team-pays-tribute-to-legendary-warrior-clan-10273704/
559,2025,IEXP,559,Who is Balwant Singh Rajoana? Why has he been on death row for 15 years?,,,Express Explained;Express Premium;Khalistan,https://indianexpress.com/article/explained/explained-history/who-was-balwant-singh-rajaona-why-has-he-been-on-death-row-for-15-years-10270693/
560,2025,IEXP,560,Explained: India-EU strategic agenda,,,European Union (EU);Express Premium;India-EU free trade agreement;India-EU FTA,https://indianexpress.com/article/explained/explained-india-eu-strategic-agenda-10273658/
561,2025,IEXP,561,"Why Karnataka HC upheld Union govt’s Sahyog portal, rejected X’s challenge",,,Explained Law;Express Explained;Karnataka,https://indianexpress.com/article/explained/explained-law/karnataka-hc-sahyog-portal-x-challenge-10269277/
562,2025,IEXP,562,60% uranium enrichment: Why Iran’s claims of not pursuing nuclear weapons lack credibility,,,Explained Sci-Tech;Express Explained;Iran nuclear enrichment,https://indianexpress.com/article/explained/explained-sci-tech/iran-uranium-enrichment-nuclear-10270503/
563,2025,IEXP,563,Survival by chance: Wheel well stowaways & perils of flying hidden in landing gear bay of aircraft,,,aircraft;Explained Sci-Tech;Express Explained;Indira Gandhi International Airport,https://indianexpress.com/article/explained/explained-sci-tech/survival-by-chance-wheel-well-stowaways-perils-of-flying-hidden-in-landing-gear-bay-of-aircraft-10272200/
564,2025,IEXP,564,"With recent World Athletics Championships, breaking down the science of the javelin",,,Explained Sports;Express Explained;javelin,https://indianexpress.com/article/explained/explained-sports/explained-the-javelins-arc-10271650/
565,2025,IEXP,565,"Where Neeraj Chopra, Arshad Nadeem and others need to improve: Javelin legend Uwe Hohn explains",,,Explained Sports;Express Explained;Neeraj Chopra,https://indianexpress.com/article/explained/explained-sports/neeraj-is-a-speed-thrower-needs-to-return-to-his-strengths-javelin-legend-uwe-hohn-10271678/
566,2025,IEXP,566,"India’s pledge to resolve ‘legal issues’ around N-power, now part of US negotiations, is easier said than done. Here’s why",,,energy;Express Explained,https://indianexpress.com/article/explained/india-legal-issues-n-power-us-negotiations-10270208/
567,2025,IEXP,567,"In Karnataka HC’s rejection of X plea against Sahyog, 3 red lines for social media",,,Expres Premium;Express Explained,https://indianexpress.com/article/explained/karnataka-hc-rejection-x-plea-sahyog-red-lines-social-media-10269942/
568,2025,IEXP,568,Agni-P missile test: All you need to know about the successful rail-based launch,,,Express Explained,https://indianexpress.com/article/explained/launched-from-train-why-agni-p-missile-test-is-significant-10271032/
569,2025,IEXP,569,MHA cancels FCRA license of Sonam Wangchuk’s NGO: All about law regulating foreign donations,,,Express Explained;FCRA;Ladakh;Sonam Wangchuk,https://indianexpress.com/article/explained/mha-cancels-fcra-license-sonam-wangchuk-ngo-10272492/
570,2025,IEXP,570,Sonam Wangchuk detained under NSA: What to know about National Security Act,,,Express Explained;Express Premium;Ladakh region;Sonam Wangchuk,https://indianexpress.com/article/explained/national-security-act-detain-sonam-wangchuk-10274411/
571,2025,IEXP,571,Smuggled luxury cars seized in Kerala: What are the legal routes for importing foreign vehicles?,,,Express Explained,https://indianexpress.com/article/explained/smuggled-luxury-cars-seized-importing-foreign-vehicles-10272638/
572,2025,IEXP,572,Why Vidyasagar continues to rule the hearts of Bengalis,,,Express Explained;Vidyasagar College,https://indianexpress.com/article/explained/why-vidyasagar-continues-to-rule-the-hearts-of-bengalis-10272934/
573,2025,IEXP,573,Blast kills 20 in Tirah Valley: Pakistan’s Taliban problem,,,Express Explained,https://indianexpress.com/article/explained/everyday-explainers/blast-kills-20-in-tirah-valley-pakistans-taliban-problem-10264975/
574,2025,IEXP,574,"On Agrasen Jayanti, what to know about the revered figure of Maharaja Agrasen",,,Everyday Explainers;Express Explained,https://indianexpress.com/article/explained/everyday-explainers/maharaja-agrasen-jayanti-history-aggarwals-10264462/
575,2025,IEXP,575,"Explained: ‘RaptureTok’, and why some in the US think the world is ending on Tuesday",,,Explained Culture;Express Explained,https://indianexpress.com/article/explained/explained-culture/rapture-christians-world-ending-tuesday-10266574/
576,2025,IEXP,576,Why Frida Kahlo’s self-portraits sell for millions,,,Explained Culture;Express Explained;Frida Kahlo,https://indianexpress.com/article/explained/explained-culture/why-frida-kahlo-self-portraits-sell-millions-10268685/
577,2025,IEXP,577,"Adani Power hits 20% upper circuit post stock split: What it means, how shareholders benefit",,,Express Explained,https://indianexpress.com/article/explained/explained-economics/adani-power-upper-circuit-post-stock-split-10264435/
578,2025,IEXP,578,Why carmakers saw record footfalls and activity on day 1 of GST 2.0,,,automobile industry;Explained Economics;Express Explained;Goods and Services tax (GST);Maruti Suzuki,https://indianexpress.com/article/explained/explained-economics/carmakers-record-footfalls-day-1-gst-10266094/
579,2025,IEXP,579,Gold’s record-breaking rally: what is keeping it going?,,,Explained Economics;Express Explained,https://indianexpress.com/article/explained/explained-economics/gold-record-breaking-rally-10265108/
580,2025,IEXP,580,"As GST 2.0 kicks in, what changes for consumers and industry?",,,Explained Economics;Express Explained;Express Premium;Goods and Services tax (GST),https://indianexpress.com/article/explained/explained-economics/gst-2-changes-consumers-industry-10264788/
581,2025,IEXP,581,India US trade deal: The much-delayed negotiations seem headed into the final leg. What lies ahead?,,,Explained Economics;Express Explained;Express Premium,https://indianexpress.com/article/explained/explained-economics/india-us-trade-negotiations-what-next-10266089/
582,2025,IEXP,582,"Trump’s ‘plan B’ for possible US Supreme Court setback on tariff powers, and what it could mean for India",,,Explained Economics;Express Explained,https://indianexpress.com/article/explained/explained-economics/trumps-plan-b-for-possible-us-supreme-court-setback-on-tariff-10268152/
583,2025,IEXP,583,"What is the contentious 2 per cent ‘Zucman Tax’, which targets France’s billionaires?",,,Explained Economics;Express Explained,https://indianexpress.com/article/explained/explained-economics/two-percent-zucman-tax-frances-billionaires-10266104/
584,2025,IEXP,584,"France joins other countries in recognising Palestine: What this means for Israel, the Gaza war",,,Explained Global;Express Explained;Express Premium,https://indianexpress.com/article/explained/explained-global/france-recognising-palestine-what-this-means-israel-gaza-10266471/
585,2025,IEXP,585,Why the K visa could be China’s answer to Donald Trump’s war on H-1B,,,Explained Global;Express Explained;Express Premium,https://indianexpress.com/article/explained/explained-global/k-visa-china-answer-donald-trump-war-h-1b-10268225/
586,2025,IEXP,586,"Explained: As H-1B fee spikes, could L-1 visa be the alternative?",,,Explained Global;Express Explained,https://indianexpress.com/article/explained/explained-global/l-1-visa-and-h-1b-10266306/
587,2025,IEXP,587,Explained: 3 key takeaways from Charlie Kirk’s memorial service,,,Explained Global;Express Explained,https://indianexpress.com/article/explained/explained-global/takeaways-charlie-kirk-memorial-service-10265015/
588,2025,IEXP,588,Why Trump has again demanded control over Afghanistan’s Bagram air base,,,Afghanistan;Explained Global;Express Explained,https://indianexpress.com/article/explained/explained-global/trump-bagram-afghanistan-significance-china-10263287/
589,2025,IEXP,589,Explained: US Supreme Court to review Humphrey’s Executor limiting President’s powers,,,Explained Global;Express Explained,https://indianexpress.com/article/explained/explained-global/us-supreme-court-review-humphreys-executor-president-powers-10266987/
590,2025,IEXP,590,Too loud to ignore: Why Indians should care about noise pollution in cities,,,Express Explained;noise pollution,https://indianexpress.com/article/explained/explained-health/explained-too-loud-to-ignore-why-indians-should-care-about-noise-pollution-in-cities-10265691/
591,2025,IEXP,591,Tylenol use during pregnancy linked to autism? An AIIMS expert unpacks Trump claim,,,Explained Sci-Tech;Express Explained;Express Premium,https://indianexpress.com/article/explained/explained-health/trump-links-tylenol-use-pregnancy-autism-10267148/
592,2025,IEXP,592,"Supreme Court to decriminalise defamation? What the law says, how this may be possible",,,Explained Law;Express Explained,https://indianexpress.com/article/explained/explained-law/supreme-court-decriminalise-defamation-law-how-possible-10268711/
593,2025,IEXP,593,UP caste-based rallies banned: The HC ruling behind the state govt order,,,Express Explained,https://indianexpress.com/article/explained/explained-law/up-bans-caste-based-political-rallies-hc-ruling-10265061/
594,2025,IEXP,594,‘Banglar Bari’: Mamata’s ambitious counter to Centre cutting of PMAY-G funds,,,Explained Politics;Express Explained;Mamata Banerjee;PMAY;West Bengal,https://indianexpress.com/article/explained/explained-politics/banglar-bari-mamata-ambitious-counter-to-centre-cutting-of-pmay-g-funds-10264832/
595,2025,IEXP,595,H-1B changes explained: How Trump’s proposed rule will favour higher-paid jobs over entry-level workers,,,H-1B,https://indianexpress.com/article/explained/h-1b-changes-trump-proposed-rule-favour-higher-paid-jobs-entry-level-workers-10268041/
596,2025,IEXP,596,"What to know about Ladakh protests demanding statehood, autonomy from Centre",,,Express Explained;Ladakh,https://indianexpress.com/article/explained/ladakh-protests-statehood-autonomy-centre-10269054/
597,2025,IEXP,597,Sikh jatha not to travel to Nankana Sahib: What is the protocol on India-Pakistan religious visits?,,,Express Explained;Kartarpur Corridor;Nankana Sahib,https://indianexpress.com/article/explained/sikh-nankana-sahib-india-pakistan-protocol-religious-visits-10266552/
598,2025,IEXP,598,Explained: Can voters be deleted without consent? The law behind Rahul Gandhi’s allegation on Aland seat,,,Rahul Gandhi,https://indianexpress.com/article/explained/aland-voter-deletion-how-names-can-be-removed-from-rolls-10260285/
599,2025,IEXP,599,"Why Bihar Congress is protesting an Adani project, what’s the govt claim",,,Express Explained,https://indianexpress.com/article/explained/bihar-congress-adani-project-govt-claim-10263372/
600,2025,IEXP,600,From Aithihyamala to Lokah: Recasting Kerala’s Folklore,,,A post shared by Wayfarer Films (@dqswayfarerfilms),https://indianexpress.com/article/explained/explained-culture/aithihyamala-lokah-kerala-folklore-10261179/
601,2025,IEXP,601,How Robert Redford changed cinema with the Sundance Film Festival,,,Explained Culture;Express Explained,https://indianexpress.com/article/explained/explained-culture/robert-redford-sundance-film-festival-10259835/
602,2025,IEXP,602,"Centre looks to simplify Quality Control Order framework: What are QCOs, criticisms",,,Bureau of Indian Standards;Explained Economics;Express Explained,https://indianexpress.com/article/explained/explained-economics/centre-simplify-qco-framework-10261635/
603,2025,IEXP,603,"FPIs may trade in gold, silver: SEBI’s proposal, potential market impact",,,Explained Economics;Express Explained;Sebi,https://indianexpress.com/article/explained/explained-economics/fpis-may-trade-gold-silver-sebis-proposal-market-impact-10263439/
604,2025,IEXP,604,"PM Modi says ‘GST savings festival’ begins: with lower prices, how household budgets are set for boost",,,Explained Economics;Express Explained;Goods and Services tax (GST),https://indianexpress.com/article/explained/explained-economics/modi-new-gst-rates-lower-prices-household-impact-10263029/
605,2025,IEXP,605,No way out of Moscow: Why Indian oil companies’ $1.4 billion worth of dividends are stuck in Russia,,,Explained Economics;Express Explained;Express Premium;Ukraine Russia conflict,https://indianexpress.com/article/explained/explained-economics/no-way-out-moscow-why-indian-oil-companies-billion-dividends-stuck-russia-10262150/
606,2025,IEXP,606,"With a $100k price tag on H-1B visas, is it the end of Indians’ American dream?",,,Explained Global;Express Explained,https://indianexpress.com/article/explained/explained-global/100k-price-tag-h1-b-visa-indian-american-dream-10260757/
607,2025,IEXP,607,Bellwether for national mood: Why Dhaka University students’ unions polls matter,,,Bangladesh;dhaka,https://indianexpress.com/article/explained/explained-global/bellwether-for-national-mood-why-dhaka-university-students-unions-polls-matter-10260283/
608,2025,IEXP,608,"China This Week | Tussles over Google, Nvidia and TikTok, and new economic data",,,China;Explained Global;Express Explained;Google;Nvidia;TikTok,https://indianexpress.com/article/explained/explained-global/china-this-week-nvidia-tiktok-economy-employment-10259936/
609,2025,IEXP,609,"Explained: H-1B visas, Indians, and the immigration discourse in the US",,,donald trump;Express Explained;H-1B visa;US,https://indianexpress.com/article/explained/explained-global/explained-h-1b-visas-indians-and-the-immigration-discourse-in-the-us-10261355/
610,2025,IEXP,610,Scoop of dissent over Gaza in the Trump era: Why Ben & Jerry’s co-founder walked away from Unilever,,,Explained Global;Express Explained;Unilever,https://indianexpress.com/article/explained/explained-global/gaza-trump-ben-jerrys-unilever-icecream-10259058/
611,2025,IEXP,611,"H-1B $100,000 entry fee explained: Who pays, who’s exempt, and what’s still unclear?",,,Explained Global;Express Explained;Express Premium,https://indianexpress.com/article/explained/explained-global/h-1b-100k-entry-fee-questions-explained-10261734/
612,2025,IEXP,612,"US, France, UK block Pak-China bid to put Baloch Liberation Army in UN sanctions list: All you need to know",,,Balochistan;Explained Global;Express Explained;UNSC,https://indianexpress.com/article/explained/explained-global/us-france-uk-block-pak-china-bid-to-put-baloch-liberation-army-in-un-sanctions-list-10260170/
613,2025,IEXP,613,US withdraws sanctions waiver to Chabahar port: Everything you need to know,,,Chabahar Port;Explained Global;Express Explained,https://indianexpress.com/article/explained/explained-global/us-sanctions-waiver-chabahar-port-10259659/
614,2025,IEXP,614,Why the visa roadblock will cast shadow on trade talks in US next week,,,Express Premium;H-1B;H-1B visa,https://indianexpress.com/article/explained/explained-global/why-the-visa-roadblock-will-cast-shadow-on-trade-talks-in-us-next-week-10262036/
615,2025,IEXP,615,Does the cover of Arundhati Roy’s latest book violate any law?,,,Arundhati Roy;COTPA;Explained Law;Express Explained,https://indianexpress.com/article/explained/explained-law/does-cover-arundhati-roy-book-violate-cotpa-7894075-10261145/
616,2025,IEXP,616,Why multiple states will file a review against SC ruling on Teaching Eligibility Test,,,Explained Law;Express Explained,https://indianexpress.com/article/explained/explained-law/states-review-petition-sc-ruling-teaching-eligibility-test-tet-10261259/
617,2025,IEXP,617,Why SC order on Anand Marriage Act won’t end old debate,,,Amritsar;Explained Law;Express Explained;Express Premium;New Delhi;supreme court,https://indianexpress.com/article/explained/explained-law/why-sc-order-on-anand-marriage-act-wont-end-old-debate-10261997/
618,2025,IEXP,618,Sikh delegation gives recommendations on ‘Jore Sahib’ to Modi: What are these holy relics?,,,Express Explained,https://indianexpress.com/article/explained/jore-sahib-modi-10261366/
619,2025,IEXP,619,Kurmis revive the agitation for ST status: Everything you need to know,,,Express Explained,https://indianexpress.com/article/explained/kurmis-revive-the-agitation-for-st-status-10262545/
620,2025,IEXP,620,Why the railways’ tunnel breakthrough matters for Mumbai-Ahmedabad bullet train project,,,Ahmedabad-Mumbai bullet train;Express Explained,https://indianexpress.com/article/explained/mumbai-ahmedabad-bullet-train-project-status-update-10262679/
621,2025,IEXP,621,"Pakistan army drawing closer to Jaish-e-Mohammad? What its leader said, implications for India",,,Express Explained;Operation Sindoor,https://indianexpress.com/article/explained/pakistan-army-jaish-e-mohammad-coming-closer-10262992/
622,2025,IEXP,622,Why India shouldn’t be worried by Saudi-Pak deal,,,Express Premium;Pakistan;Saudi Arabia;Shahbaz Sharif,https://indianexpress.com/article/explained/why-india-shouldnt-be-worried-by-saudi-pak-deal-10260284/
623,2025,IEXP,623,"Topography, climate change: Behind the heavy rain in Uttarakhand, Himachal",,,Climate change;Dehradun;Express Premium;Uttarakhand;Uttarakhand Govt,https://indianexpress.com/article/explained/explained-climate/topography-climate-change-behind-heavy-rains-in-himalayas-10254105/
624,2025,IEXP,624,Charlie Kirk suspect’s texts to ‘trans’ roommate: Evolution of transgender rights in the US,,,Explained Culture;Express Explained,https://indianexpress.com/article/explained/explained-culture/charlie-kirk-tyler-robinson-texts-roommate-transgender-rights-us-10255980/
625,2025,IEXP,625,"Adani gets SEBI clean chit, but some Hindenburg allegations remain unanswered",,,adani group;Explained Economics;Express Explained;Express Premium;Hindenburg Research;Sebi,https://indianexpress.com/article/explained/explained-economics/adani-group-clean-chit-hindenburg-case-sebis-final-order-10258630/
626,2025,IEXP,626,Bima Sugam portal launched: Single digital marketplace for all kinds of insurance,,,Explained Economics;Express Explained,https://indianexpress.com/article/explained/explained-economics/bima-sugam-portal-single-digital-marketplace-insurance-10255737/
627,2025,IEXP,627,ExplainSpeaking: Understanding US Fed’s dual mandate dilemma through 6 quotes from Jerome Powell,,,Explained Economics;EXPLAINSPEAKING;Express Explained;Express Premium;Jerome Powell;US Fed Reserve,https://indianexpress.com/article/explained/explained-economics/explainspeaking-understanding-us-feds-dual-mandate-dilemma-through-6-quotes-from-jerome-powell-10258307/
628,2025,IEXP,628,"Why low inflation is a problem for government’s finances, Budget targets",,,Explained Economics;Express Explained;Express Premium,https://indianexpress.com/article/explained/explained-economics/low-inflation-problem-government-budget-targets-10256765/
629,2025,IEXP,629,"Tyler Robinson’s texts to roommate, DNA on gun: 3 things US prosecutors said about Charlie Kirk’s murder suspect",,,Explained Global;Express Explained,https://indianexpress.com/article/explained/explained-global/charlie-kirks-tyler-robinson-prosecution-claims-10255703/
630,2025,IEXP,630,"With ‘Jimmy Kimmel Live!’ taken off air, a brief history of late-night TV shows",,,Explained Global;Express Explained;Jimmy Kimmel;late night,https://indianexpress.com/article/explained/explained-global/jimmy-kimmel-off-air-history-late-night-tv-10257535/
631,2025,IEXP,631,Saudi Arabia-Pakistan defence pact: What it means for the two countries,,,Explained Global;Express Explained;Express Premium,https://indianexpress.com/article/explained/explained-global/saudi-arabia-pakistan-defence-pact-significance-10257728/
632,2025,IEXP,632,"Stephen Miran: Trump tariff architect, now in US Fed",,,donald trump;Express Premium;US federal reserve,https://indianexpress.com/article/explained/explained-global/stephen-miran-trump-tariff-architect-now-in-us-fed-10256410/
633,2025,IEXP,633,Trump celebrates as Jimmy Kimmel goes off air: why are US broadcasters toeing the line?,,,Explained Global;Express Explained;Jimmy Kimmel,https://indianexpress.com/article/explained/explained-global/trump-celebrates-jimmy-kimmel-late-show-10257092/
634,2025,IEXP,634,Tracing history of Sarnath: from Buddha’s first sermon to emblem of Indian republic,,,Buddhism;Express Explained;Sarnath;UNESCO,https://indianexpress.com/article/explained/explained-history/tracing-history-sarnath-from-buddhas-first-sermon-to-emblem-of-indian-republic-10255804/
635,2025,IEXP,635,What petitioners are arguing against online gaming ban,,,Explained Law;Express Explained,https://indianexpress.com/article/explained/explained-law/petitioners-arguments-online-gaming-ban-10257966/
636,2025,IEXP,636,"Rahul Gandhi attacks EC: What happened in Aland seat, who can delete names from electoral roll",,,Express Explained,https://indianexpress.com/article/explained/explained-politics/rahul-gandhi-election-commission-aland-seat-blo-electoral-roll-10257185/
637,2025,IEXP,637,How scientists found an ant which gives birth to two species,,,Express Premium,https://indianexpress.com/article/explained/explained-sci-tech/how-scientists-found-an-ant-which-gives-birth-to-two-species-10256377/
638,2025,IEXP,638,Explained: How India is simulating space on Earth to write its own astronaut protocols,,,Explained Sci-Tech;Express Explained;Gaganyaan,https://indianexpress.com/article/explained/explained-sci-tech/indian-analog-experiments-space-earth-10257197/
639,2025,IEXP,639,Nvidia’s $5 billion stake in Intel marks a dramatic change of fortune. But will it help the beleaguered chipmaker?,,,Express Explained;Nvidia,https://indianexpress.com/article/explained/explained-sci-tech/nvidia-5-billion-stake-intel-impact-10258875/
640,2025,IEXP,640,Why Army is rushing to procure new radars after Operation Sindoor drone breaches,,,Express Premium;Indian army,https://indianexpress.com/article/explained/explained-upgrading-army-radars-10256376/
641,2025,IEXP,641,What to know about Global Ayyappa Sangamam being organised by Kerala’s LDF govt,,,Express Explained,https://indianexpress.com/article/explained/global-ayyappa-sangamam-kerala-ldf-govt-10257738/
642,2025,IEXP,642,Mumbai’s first fully underground metro: All you need to know about Metro Line 3,,,Express Explained,https://indianexpress.com/article/explained/mumbai-first-fully-underground-metro-line-3-10257142/
643,2025,IEXP,643,"Mumbai Monorail comes to a halt: why services are suspended, what’s the road ahead",,,Express Explained;Mumbai monorail,https://indianexpress.com/article/explained/mumbai-monorail-why-services-are-suspended-road-ahead-10255743/
644,2025,IEXP,644,Prior restraint: How gag order in Adani case flies in face of what SC has ruled,,,adani group;Express Explained,https://indianexpress.com/article/explained/prior-restraint-gag-order-in-adani-case-flies-in-face-of-what-sc-has-ruled-10258396/
645,2025,IEXP,645,"Who are Rohit Godara & Goldy Brar, gangsters said to have orchestrated firing at Disha Patani’s house?",,,Disha Patani;Express Explained;Punjab Gangster,https://indianexpress.com/article/explained/rohit-godara-goldy-brar-gangsters-said-to-have-orchestrated-disha-patani-10257522/
646,2025,IEXP,646,What are the welfare schemes and campaigns that have been launched to mark Modi’s 75th birthday?,,,Express Explained,https://indianexpress.com/article/explained/welfare-schemes-campaigns-modis-birthday-10255283/
647,2025,IEXP,647,"Why Bihar’s new Purnea airport, like in Darbhanga, uses porta cabins",,,Express Explained,https://indianexpress.com/article/explained/why-bihars-new-purnea-airport-like-darbhanga-uses-porta-cabins-10255474/
648,2025,IEXP,648,Trump hints at TikTok deal with China: What to know about the app’s criticisms,,,Everyday Explainers;Everyday Global;Express Explained;TikTok,https://indianexpress.com/article/explained/everyday-explainers/tiktok-deal-us-china-trump-10251771/
