id,year,paper,question_no,question_text,word_limit,marks,topic_hint,source_url
844,2025,IEXP,844,"With Nepal’s objection, recalling significance of Lipulekh for India, and the China angle",,,Express Explained;India Nepal relations,https://indianexpress.com/article/explained/nepal-objection-lipulekh-importance-china-10203147/
845,2025,IEXP,845,"The one factor impacting efficacy of planting trees for the climate, according to a new study",,,Climate change;Express Explained,https://indianexpress.com/article/explained/planting-trees-in-tropics-has-most-positive-climate-impacts-study-10203796/
846,2025,IEXP,846,What Uttarakhand’s Bill to govern minority educational institution says,,,Dehradun;Express Premium;Uttarakhand;Uttarakhand Assembly,https://indianexpress.com/article/explained/what-uttarakhands-bill-to-govern-minority-educational-institution-says-10201681/
847,2025,IEXP,847,Why smart meters are facing fierce opposition in Rajasthan,,,Express Explained;Rajasthan,https://indianexpress.com/article/explained/why-smart-meters-are-facing-fierce-opposition-in-rajasthan-10207301/
848,2025,IEXP,848,Taylor Swift’s new album has ‘Portofino Orange Glitter’ theme: what is this colour,,,Express Explained;Taylor Swift,https://indianexpress.com/article/explained/everyday-explainers/taylor-swift-new-album-portofino-orange-glitter-theme-10194920/
849,2025,IEXP,849,Kishtwar flash flood: How climate change has contributed to extreme weather events in J&K,,,Express Explained;Express Premium;Kishtwar,https://indianexpress.com/article/explained/explained-climate/kishtwar-flash-flood-how-climate-change-has-contributed-to-extreme-weather-events-in-jk-10191928/
850,2025,IEXP,850,Mumbai heavy rainfall 2025: Why city is witnessing wettest August in 5 years,,,Express Explained,https://indianexpress.com/article/explained/explained-climate/mumbai-rain-rainiest-august-in-5-years-why-10198739/
851,2025,IEXP,851,"Empathy for animals, power of observation: Behind Manjit Bawa’s bovines symbolism",,,Explained Culture;Express Explained,https://indianexpress.com/article/explained/explained-culture/manjit-bawa-bovines-symbols-meaning-10194326/
852,2025,IEXP,852,Will broligarchs ruin language? What the Cambridge Dictionary’s new words tell us,,,Express Explained,https://indianexpress.com/article/explained/explained-culture/tradwives-delulu-broligarchs-cambridge-dictionarys-10196838/
853,2025,IEXP,853,S&P rating upgrade: how India earned it and what lies ahead,,,Explained Economics;Express Explained;Express Premium;Standard and Poor's,https://indianexpress.com/article/explained/explained-economics/sp-global-ratings-upgrade-india-significance-10194587/
854,2025,IEXP,854,"The Alaska Report Card: First assessment of who won what, and how",,,donald trump;President Vladimir Putin,https://indianexpress.com/article/explained/explained-global/donald-trump-vladimir-putin-alaska-meet-report-card-10192590/
855,2025,IEXP,855,"Unfinished Alaska talks, US-Russia ties: Beyond oil tariff against India",,,donald trump;Express Explained;Express Premium;President Vladimir Putin,https://indianexpress.com/article/explained/explained-global/donald-trump-vladimir-putin-russia-ukraine-war-no-deal-india-choices-10192240/
856,2025,IEXP,856,How right-wing outcry influenced US pausing visitor visas for Gazans,,,Explained Global;Express Explained;Gaza,https://indianexpress.com/article/explained/explained-global/gaza-visas-children-laura-loomer-israel-us-10195056/
857,2025,IEXP,857,Putin invites Trump to Moscow: a brief account of previous US Presidents’ visits to Russia,,,Explained Global;Express Explained;President Vladimir Putin;Russia Ukraine;US President Donald Trump,https://indianexpress.com/article/explained/explained-global/putin-invites-trump-to-moscow-a-brief-account-of-previous-us-presidents-visits-to-russia-10193150/
858,2025,IEXP,858,Mossad chief visits Qatar: Why this gulf state is the new hub of deals and diplomacy,,,Express Explained,https://indianexpress.com/article/explained/explained-global/qatar-why-hub-of-deals-and-diplomacy-10195284/
859,2025,IEXP,859,Russia or Ukraine: Who does Crimea belong to?,,,Explained Global;Express Explained,https://indianexpress.com/article/explained/explained-global/russia-ukraine-crimea-10198474/
860,2025,IEXP,860,"Why China plans to connect the restive Xinjiang to Tibet, at India’s doorstep",,,China;Explained Global;Express Explained;Line of Actual Control (LAC);Tibet;Xinjiang,https://indianexpress.com/article/explained/explained-global/why-china-has-constructed-a-rail-line-between-restive-xinjiang-and-tibet-10199546/
861,2025,IEXP,861,3 new cases of ‘brain-eating amoeba’ in Kerala: What you should know,,,Express Explained;Kerala,https://indianexpress.com/article/explained/explained-health/brain-eating-amoeba-meaning-kerala-case-symptoms-10198678/
862,2025,IEXP,862,How Irish nationalists inspired a future Indian President,,,Express Explained;Express Premium;Ireland,https://indianexpress.com/article/explained/explained-history/how-irish-nationalists-inspired-a-future-indian-president-10197528/
863,2025,IEXP,863,SC overturns sarpanch election results in Haryana: When can courts order a recount of votes?,,,Explained Law;Express Explained,https://indianexpress.com/article/explained/explained-law/courts-recount-votes-election-10196590/
864,2025,IEXP,864,Opposition considers motion to remove Chief Election Commissioner: What is the process?,,,Chief Election Commissioner;Election Commission of India;Explained Law;Express Explained,https://indianexpress.com/article/explained/explained-law/opposition-considers-motion-to-remove-chief-election-commissioner-10196734/
865,2025,IEXP,865,"Longer jail sentences, UP as template: All about Uttarakhand’s Bill against forced religious conversion",,,Explained Law;Express Explained;religious conversion;Uttarakhand,https://indianexpress.com/article/explained/explained-law/uttarakhand-forced-religious-conversion-jail-up-bill-10194981/
866,2025,IEXP,866,Constitution 130th Amendment Bill 2025 sent to Join Committee amid uproar: 5 things you need to know,,,Express Explained,https://indianexpress.com/article/explained/explained-politics/130th-amendment-bill-2025-join-committee-all-you-need-to-know-10200955/
867,2025,IEXP,867,Why premium chocolates taste flavourful,,,Explained Sci-Tech;Express Explained,https://indianexpress.com/article/explained/explained-sci-tech/chocolates-taste-10200995/
868,2025,IEXP,868,How scientists built a password-protected mind-reading brain implant,,,Explained Sci-Tech;Express Explained,https://indianexpress.com/article/explained/explained-sci-tech/password-protected-mind-reading-brain-implant-10193081/
869,2025,IEXP,869,Why every tiger carcass requires a postmortem,,,Express Explained;Express Premium,https://indianexpress.com/article/explained/tiger-carcass-postmortem-10196880/
870,2025,IEXP,870,Election Commission Vs West Bengal: Who controls poll officials? EC or the states?,,,Election Commission;Election Commission of India;Express Premium,https://indianexpress.com/article/explained/who-controls-election-officials-ec-or-the-states-10199544/
871,2025,IEXP,871,Why Africa wants to ditch popular world map,,,Africa;Express Premium,https://indianexpress.com/article/explained/why-africa-wants-to-ditch-popular-world-map-10199545/
872,2025,IEXP,872,Why Centre is considering ‘equivalence’ in application of ‘creamy layer’ condition in OBC quota,,,Caste-based reservation;Express Explained;Express Premium;NITI Aayog;OBC,https://indianexpress.com/article/explained/why-centre-is-considering-equivalence-in-application-of-creamy-layer-condition-in-obc-quota-10197523/
873,2025,IEXP,873,"Bihar SIR: Bench sends a reminder on right to vote, fairness and transparency",,,Bihar;Election Commission of India;Express Explained,https://indianexpress.com/article/explained/bihar-sir-bench-sends-a-reminder-on-right-to-vote-fairness-and-transparency-10190160/
874,2025,IEXP,874,The spineless foe of nuclear power plants: How jellyfish disrupt these facilities,,,Explained Climate;Express Explained,https://indianexpress.com/article/explained/explained-climate/nuclear-power-plants-jellyfish-10187058/
875,2025,IEXP,875,US trade truce with China: What is the agri trump card that Beijing holds,,,donald trump;Express Premium,https://indianexpress.com/article/explained/explained-economics/behind-us-china-trade-truce-10185535/
876,2025,IEXP,876,Business of films: Why Aamir Khan took ‘Sitaare Zameen Par’ to YouTube,,,Aamir Khan;Explained Economics;Express Explained;Express Premium;Sitaare Zameen Par;youtube,https://indianexpress.com/article/explained/explained-economics/business-of-films-why-aamir-khan-took-sitaare-zameen-par-to-youtube-10191931/
877,2025,IEXP,877,"New Income Tax Bill 2025 passed in Parliament: key features, what changes",,,Explained Economics;Express Explained,https://indianexpress.com/article/explained/explained-economics/new-income-tax-bill-passed-in-parliament-key-features-10186767/
878,2025,IEXP,878,"Ahead of Trump-Putin Alaska summit, what US, Russia and Ukraine want",,,donald trump;Explained Global;Express Explained;Express Premium;Ukraine,https://indianexpress.com/article/explained/explained-global/ahead-of-alaska-summit-what-us-russia-ukraine-want-10190143/
879,2025,IEXP,879,"All about Candace Owens, the controversial political commentator being sued by French President Macron",,,Emmanuel Macron;Explained Global;Express Explained,https://indianexpress.com/article/explained/explained-global/candace-owens-controversy-politics-trump-macron-france-10190845/
880,2025,IEXP,880,"China This Week | US-China tariff truce holds, ‘unprecedented’ deal with Nvidia, and more",,,China;Explained Global;Express Explained;Nvidia;US Tariffs,https://indianexpress.com/article/explained/explained-global/china-this-week-us-china-tariff-nvidia-liu-wang-yi-flights-10191584/
881,2025,IEXP,881,Why many Chinese foreign affairs analysts reacted critically to PM Modi’s likely China visit,,,Explained Global;Express Explained;Express Premium;India China relations;India US relations;Shanghai Cooperation Organisation,https://indianexpress.com/article/explained/explained-global/chinese-reaction-pm-modi-visit-us-trump-10189096/
882,2025,IEXP,882,"Little to gain, lots to lose: Where Ukraine stands ahead of Trump-Putin meet",,,Doanld Trump;Explained Global;Express Explained;President Vladimir Putin;Russia;Ukraine,https://indianexpress.com/article/explained/explained-global/little-to-gain-lots-to-lose-where-ukraine-stands-ahead-of-trump-putin-meet-10186943/
883,2025,IEXP,883,What might a Russia-Ukraine ‘land swap’ entail?,,,Explained Global;Express Explained;President Vladimir Putin;Russia;Ukraine;US President Donald Trump,https://indianexpress.com/article/explained/explained-global/russia-ukraine-land-swap-entail-10191789/
884,2025,IEXP,884,The importance of Chief of the Pakistan Army Syed Asim Munir,,,Express Premium;Pakistan,https://indianexpress.com/article/explained/explained-global/the-importance-of-chief-of-the-pakistan-army-syed-asim-munir-10187755/
885,2025,IEXP,885,US designates Baloch group as terror organisation: Significance of step,,,Express Explained,https://indianexpress.com/article/explained/explained-global/us-designates-fto-majeed-brigade-significance-balochistan-10184933/
886,2025,IEXP,886,"As Trump, Putin meet in Alaska, story of how ‘Russian America’ came to US",,,Alaska;donald trump;Express Explained;Express Premium;vladimir putin,https://indianexpress.com/article/explained/explained-history/as-trump-putin-meet-in-alaska-story-of-how-russian-america-came-to-us-10190139/
887,2025,IEXP,887,Why PMs deliver Independence Day address from Red Fort,,,Express Explained;Independence Day;Narendra Modi;Red Fort,https://indianexpress.com/article/explained/explained-history/why-pm-deliver-independence-day-address-from-red-fort-10189261/
888,2025,IEXP,888,"As Houses pass Sports Governance Bill, recalling BCCI opposition to RTI",,,BCCI;Express Premium,https://indianexpress.com/article/explained/explained-law/as-houses-pass-sports-governance-bill-recalling-bcci-opposition-to-rti-10185537/
889,2025,IEXP,889,All about Assam’s new arms licence portal for ‘indigenous citizens’ in ‘vulnerable areas’,,,arms act;Assam;Explained Law;Express Explained;Himanta Biswa Sarma,https://indianexpress.com/article/explained/explained-law/assam-new-arms-license-portal-for-indigenous-citizens-in-vulnerable-areas-10189229/
890,2025,IEXP,890,Delhi govt passes Bill to regulate private school fees: What it says — and why parents are concerned,,,Explained Law;Express Explained,https://indianexpress.com/article/explained/explained-law/delhi-bill-private-school-fees-10184625/
891,2025,IEXP,891,What is the difference between civil & criminal cases?,,,Explained Law;Express Explained;J B Pardiwala;supreme court,https://indianexpress.com/article/explained/explained-law/difference-civil-criminal-cases-10191186/
892,2025,IEXP,892,Push for transparency: What Supreme Court’s order on Bihar SIR says,,,supreme court,https://indianexpress.com/article/explained/explained-law/push-for-transparency-what-supreme-courts-order-on-bihar-sir-says-10190140/
893,2025,IEXP,893,Perplexity’s $34.5B Chrome bid: How AI is fueling the next browser wars,,,Explained Sci-Tech;Express Explained,https://indianexpress.com/article/explained/explained-sci-tech/perplexitys-34-5b-chrome-bid-ai-browser-wars-10189247/
894,2025,IEXP,894,When your pet needs a blood transfusion: Govt’s plan to set up a network of blood banks for animals,,,Express Explained;pets,https://indianexpress.com/article/explained/pet-blood-transfusion-govt-banks-faq-10184912/
895,2025,IEXP,895,SC suggests converting Noida into a metropolitan corporation. What does this mean?,,,Express Explained;Noida,https://indianexpress.com/article/explained/sc-noida-metropolitan-corporation-what-mean-10188964/
896,2025,IEXP,896,Why the plastics treaty negotiations failed again,,,Express Explained;Microplastics;Plastic Pollution,https://indianexpress.com/article/explained/why-plastics-treaty-negotiations-failed-again-10191502/
897,2025,IEXP,897,Why returning sterilised dogs to streets is key to ABC’s success,,,ABC;Express Explained;Stray dog,https://indianexpress.com/article/explained/why-returning-sterilised-dogs-to-streets-is-key-to-abcs-success-10187160/
898,2025,IEXP,898,"With ‘8 lakh’ stray dogs in Delhi and no govt shelters, how SC order will impact official policy",,,Delhi NCR;Express Explained;Express Premium;stray dogs,https://indianexpress.com/article/explained/8-lakh-strays-no-govt-shelters-delhi-has-to-redraw-its-plan-10183640/
899,2025,IEXP,899,Explained: CBSE’s plan for open-book exams and what it means for students,,,CBSE;Express Explained;NEP 2020,https://indianexpress.com/article/explained/cbse-open-book-exams-meaning-impact-school-students-10184529/
900,2025,IEXP,900,"The messages Delhi underlined with Op Sindoor details, amid US tilt to Pakistan and 25% Russian penalty",,,Express Explained;Express Premium;India-US ties;Operation Sindoor,https://indianexpress.com/article/explained/delhi-underlines-its-message-amid-us-tilt-to-pakistan-and-25-russian-penalty-10180257/
901,2025,IEXP,901,"S-400 hailed for Operation Sindoor role: What is this Russia-made weapon system, how India bought it under US retaliation cloud",,,Everyday Explainers;Everyday Global;Express Explained;S-400,https://indianexpress.com/article/explained/everyday-explainers/s-400-operation-sindoor-role-russia-us-capabilities-range-10181334/
902,2025,IEXP,902,"Dharali disaster: the complex, uncertain relationship between extreme rain, landslides & flash floods",,,Explained Climate;Express Explained;Uttarkashi,https://indianexpress.com/article/explained/explained-climate/complex-uncertain-relationship-extreme-rain-landslides-flash-floods-10178912/
903,2025,IEXP,903,How Tyeb Mehta’s signature ‘bulls’ symbolised ‘the condition of human captivity’,,,1947 partition;Explained Culture;Express Explained;Tyeb Mehta,https://indianexpress.com/article/explained/explained-culture/tyeb-mehta-signature-bulls-symbolised-condition-of-human-captivity-10179704/
904,2025,IEXP,904,Why Goa legislators want bull fighting to be legalised,,,Bull fight;Explained Culture;Express Explained;Goa,https://indianexpress.com/article/explained/explained-culture/why-goa-legislators-want-bull-fighting-to-be-legalised-10178079/
905,2025,IEXP,905,How India’s farm exports are faring better than overall goods exports,,,Explained Economics;Express Explained;farm exports,https://indianexpress.com/article/explained/explained-economics/indias-rising-farm-exports-10181901/
906,2025,IEXP,906,Authorities allegedly ‘take away’ top Chinese diplomat: Who is Liu Jianchao?,,,China;Explained Global;Express Explained,https://indianexpress.com/article/explained/explained-global/china-diplomat-liu-jianchao-missing-xi-10183233/
907,2025,IEXP,907,"China This Week | Putin dials Xi, China frowns at India-Philippines drills, but welcomes PM Modi for visit",,,China;Explained Global;Express Explained;India China ties;Shanghai Cooperation Organisation,https://indianexpress.com/article/explained/explained-global/china-this-week-putin-dials-xi-phillipines-india-modi-visit-10178303/
908,2025,IEXP,908,How Israel’s Gaza war has thrown future of IMEC up in the air,,,Explained Global;Express Explained;Express Premium;Israel,https://indianexpress.com/article/explained/explained-global/israel-gaza-war-imec-10179793/
909,2025,IEXP,909,"What’s driving Japan’s population fall, with record decline of 900,000 people in 2024",,,Explained Global;Express Explained;fertility;Japan,https://indianexpress.com/article/explained/explained-global/japan-population-fall-record-reason-solutions-10181552/
910,2025,IEXP,910,"After almost losing Trump, how Putin got his ideal summit, and what it means for Ukraine",,,Explained Global;Express Explained;Russian President Vladimir Putin,https://indianexpress.com/article/explained/explained-global/trump-putin-ukraine-russia-war-alaska-10181623/
911,2025,IEXP,911,Why US funding cuts on mRNA vaccine research are significant,,,Express Explained,https://indianexpress.com/article/explained/explained-health/us-funding-cuts-mrna-vaccines-10179830/
912,2025,IEXP,912,Was Jaisalmer ever a part of the Maratha empire? Here’s what historians say,,,Express Explained;Express Premium;Jaisalmer;Maratha;Maratha Era;NCERT;Rajput,https://indianexpress.com/article/explained/explained-history/jaisalmer-maratha-empire-history-10178204/
913,2025,IEXP,913,How BCCI has continued to resist attempts to bring it under RTI scanner,,,BCCI;Explained Law;Express Explained;Right to Information,https://indianexpress.com/article/explained/explained-law/bcci-under-rti-cricket-governance-sports-bill-10181168/
914,2025,IEXP,914,"Explained: How govt, courts have dealt with stray dogs",,,Express Explained;Express Premium;rabies;stray dogs;supreme court,https://indianexpress.com/article/explained/explained-law/how-govt-courts-have-dealt-with-stray-dogs-10183748/
915,2025,IEXP,915,J&K Home Department ‘forfeits’ 25 books: What does it mean?,,,Explained Law;Express Explained,https://indianexpress.com/article/explained/explained-law/jk-home-department-forfeits-books-10179885/
916,2025,IEXP,916,An eye on CO2 from space could soon shut: why this matters,,,NASA,https://indianexpress.com/article/explained/explained-sci-tech/an-eye-on-co2-from-space-could-soon-shut-why-this-matters-10183744/
917,2025,IEXP,917,Google as a ‘monopolist’: What remedies could a US court suggest for curbing its market dominance?,,,Explained Sci-Tech;Express Explained;Google,https://indianexpress.com/article/explained/explained-sci-tech/google-monopoly-remedies-case-chrome-impact-10178063/
918,2025,IEXP,918,What does the Kerala draft anti-ragging Bill say?,,,Express Explained,https://indianexpress.com/article/explained/kerala-draft-anti-ragging-bill-10178113/
919,2025,IEXP,919,Why an order by Mumbai’s civic body on feeding pigeons is now before HC,,,Express Explained;Express Premium;pigeons,https://indianexpress.com/article/explained/mumbai-bmc-feeding-pigeons-ban-high-court-10178768/
920,2025,IEXP,920,Operation Sindoor’s 300-km kill: How the Indian Air Force may have set a rare record,,,Operation Sindoor,https://indianexpress.com/article/explained/operation-sindoor-300-km-kill-indian-air-force-set-rare-record-10180497/
921,2025,IEXP,921,Why Punjab’s seed dealers are concerned about the govt’s move to make sale of spurious seeds a non-bailable offence,,,Express Explained,https://indianexpress.com/article/explained/punjab-seed-dealers-sale-spurious-non-bailable-offence-10178311/
922,2025,IEXP,922,"Why, to tackle the stray dog problem, it is important to make pet owners accountable, too",,,Express Explained;stray dogs,https://indianexpress.com/article/explained/stray-dog-problem-solution-sc-pet-owners-debate-10183192/
923,2025,IEXP,923,"After Trump doubles tariff, India’s strategy: Remain quiet, don’t give in, wait it out for now",,,Doanld Trump;Express Explained;Express Premium,https://indianexpress.com/article/explained/after-trump-doubles-tariff-indias-strategy-remain-quiet-dont-give-in-wait-it-out-for-now-10176697/
924,2025,IEXP,924,Bengaluru metro’s Yellow Line to be inaugurated on Sunday: Why the project was delayed for years,,,Bengaluru Metro;Express Explained,https://indianexpress.com/article/explained/bengaluru-metro-yellow-line-10177953/
925,2025,IEXP,925,"In 12 years, 5 billion starfish ‘wasted away’ from a mysterious disease: How culprit was finally found",,,Express Explained,https://indianexpress.com/article/explained/everyday-explainers/5-billion-starfish-wasted-away-mysterious-disease-culprit-10173862/
926,2025,IEXP,926,"What caused Uttarkashi flash floods: Heavy rainfall, rugged topography",,,Express Explained;Uttarkashi,https://indianexpress.com/article/explained/explained-climate/heavy-rainfall-rugged-topography-what-caused-flash-floods-in-uttarkashi-10171931/
927,2025,IEXP,927,How to reduce risks from glacial lake bursts and carry out effective rescue operations,,,Explained Climate;Express Explained;Uttarkashi,https://indianexpress.com/article/explained/explained-climate/reduce-risks-glacial-lake-bursts-effective-rescue-operations-10177422/
928,2025,IEXP,928,Why Maharashtra Govt wants film ‘Khalid Ka Shivaji’ put on hold,,,Explained Culture;Express Explained,https://indianexpress.com/article/explained/explained-culture/khalid-ka-shivaji-row-marathi-film-bjp-10173522/
929,2025,IEXP,929,"As Apple pledges $100 bn additional investment in US, likely impact on India",,,Explained Economics;Express Explained,https://indianexpress.com/article/explained/explained-economics/apple-pledges-100-bn-investment-us-impact-india-10175566/
930,2025,IEXP,930,ExplainSpeaking: What Trump’s tariff abuse teaches India,,,Explained Economics;EXPLAINSPEAKING;Express Explained;US Tariffs,https://indianexpress.com/article/explained/explained-economics/explainspeaking-trump-tariff-abuse-lessons-india-10176242/
931,2025,IEXP,931,BCG analysed plan to ‘relocate’ Gazans to Somalia: What Financial Times’ report found,,,BCG;Explained Global;Express Explained;Gaza;Israel,https://indianexpress.com/article/explained/explained-global/bcg-plan-relocate-gaza-somalia-ft-riviera-10176212/
932,2025,IEXP,932,Explained Interview | What to expect from the Trump-Putin meeting,,,Doanld Trump;Express Explained;Express Premium;Russia;vladimir putin,https://indianexpress.com/article/explained/explained-global/explained-interview-what-to-expect-from-the-trump-putin-meeting-10176639/
933,2025,IEXP,933,What is gerrymandering and why Democrat lawmakers fled Texas,,,Express Explained,https://indianexpress.com/article/explained/explained-global/gerrymandering-drama-in-texas-democrats-left-state-10175923/
934,2025,IEXP,934,How a US tech firm filled its coffers by helping Israel bomb Gaza & enabling Trump to spy on his critics,,,Explained Global;Express Explained,https://indianexpress.com/article/explained/explained-global/palantir-trump-gaza-10173572/
935,2025,IEXP,935,The Philippines’ President in India: What to know about Marcos ‘Bongbong’ Junior,,,Explained Global;Express Explained;Philippines;south china sea,https://indianexpress.com/article/explained/explained-global/philippines-president-india-marcos-bongbong-jr-life-politics-china-10171576/
936,2025,IEXP,936,Why Trump has called for the resignation of Intel’s CEO,,,Explained Global;Express Explained,https://indianexpress.com/article/explained/explained-global/trump-intels-ceo-10177801/
937,2025,IEXP,937,Gangster Abu Salem seeks early release: The maths behind his 25-year prison term,,,abu salem;Explained Law;Express Explained,https://indianexpress.com/article/explained/explained-law/abu-salem-free-case-jail-maharashtra-10176123/
938,2025,IEXP,938,AgustaWestland scam accused Christian Michel’s plea rejected: When can an undertrial be freed from prison?,,,AgustaWestland case;Christian Michel;Explained Law;Express Explained,https://indianexpress.com/article/explained/explained-law/agustawestland-christian-michels-plea-rejected-undertrial-free-10178033/
939,2025,IEXP,939,Are the Rohingya ‘refugees’? Supreme Court will consider – but there is a problem,,,Explained Law;Express Explained;Rohingya,https://indianexpress.com/article/explained/explained-law/rohingya-refugees-supreme-10173839/
940,2025,IEXP,940,Why Sylheti is not a ‘Bangladeshi language’,,,Express Explained;Express Premium,https://indianexpress.com/article/explained/explained-politics/why-sylheti-is-not-a-bangladeshi-language-10174546/
