id,year,paper,question_no,question_text,word_limit,marks,topic_hint,source_url
5,2025,The Hindu,5,"Camillo Golgi and Santiago Ramón y Cajal: Nobel Prize-winning pioneers who described the nervous systemPremium Though divided by fierce scientific rivalry — Golgi defending the idea of a continuous nerve network, Cajal championing the “neuron doctrine”, their discoveries together reshaped biology. Golgi’s revolutionary staining method revealed the hidden architecture of nerve cells, while Cajal’s interpretations proved that the nervous system was made of individual units: neurons. Their Nobel Prize marked not only a clash of ideas but the birth of modern neuroscience, and its impact extends to global health, neurology, psychiatry and public policy even today. Camillo Golgi was born on July 7, 1843, in Corteno, Italy. From modest beginnings, he studied medicine at the University of Pavia and began his career as a physician in psychiatric and hospital wards. With limited resources, he improvised laboratory space in his own kitchen. Out of these unassuming beginnings came one of the most transformative methods in biology: the silver chromate stain (a chemical reaction used to create a brick-red or brown-black color to make certain things, especially cells, visible under a microscope). Santiago Ramón y Cajal, born on May 1, 1852, in Petilla de Aragón, Spain, was raised under the stern discipline of his physician father. A gifted illustrator who once dreamed of becoming an artist, he redirected his talents toward science. His eye for detail and artistic hand later gave rise to some of the most iconic images in the history of medicine: the first clear drawings of neurons. In 1873, Golgi developed thereazione nera— the “black reaction.” The method impregnated a small fraction of nerve cells with silver chromate, revealing their entire shape under the microscope: cell body, dendrites, and axon. For the first time, the nervous system was visible not as a blur but as a forest of branching, living structures. A human neocortical pyramidal neuron stained via Golgi technique. Photo: Wikimedia Commons Golgi interpreted these findings through the lens of the reticular theory, which held th",,,,https://www.thehindu.com/sci-tech/health/camillo-golgi-and-santiago-ramon-y-cajal-nobel-prize-winning-pioneers-who-described-the-nervous-system/article70145515.ece
6,2025,The Hindu,6,"Robert Koch’s Nobel Prize: winning discoveries on tuberculosis and the foundations of bacteriologyPremium In 1905, German physician and microbiologist Robert Koch was awarded the Nobel Prize in Physiology or Medicine “for his investigations and discoveries in relation to tuberculosis.” At a time when TB claimed millions of lives, Koch’s identification of Mycobacterium tuberculosis as the causative agent transformed medical science and confirmed that the disease was infectious, not hereditary. The discovery not only guided prevention and treatment but also shaped public health strategies worldwide. Robert Koch was born on December 11, 1843, in Clausthal, a mining town in the Harz Mountains of Germany. A precocious child, he taught himself to read by age five and later studied medicine at the University of Göttingen, where pathologist Jacob Henle, an early proponent of germ theory left a lasting influence. After graduating in 1866, Koch worked as a country doctor and briefly served as a military physician during the Franco-Prussian War. Without access to formal laboratory facilities, he built his own microscopes and equipment, devising simple but effective methods that foreshadowed his breakthroughs in microbiology. Koch’s first great success came in 1876, when he identified Bacillus anthracis as the cause of anthrax. He introduced new methods to culture bacteria in pure form using gelatin and later agar, and developed staining techniques to make microbes visible under the microscope. From these experiments, he formulated Koch’s postulates, four criteria to establish a causal link between a microorganism and a disease. These postulates provided microbiology with its first rigorous framework, which continues to influence infectious disease research today, though adapted for viruses and molecular methods. Koch’s most celebrated discovery came in 1882. In a landmark lecture to the Berlin Physiological Society, he announced that he had identified the tubercle bacillus (Mycobacterium tuberculosis) as the cause of tuberculosis. By applying his staining techniques, he demonstrat",,,,https://www.thehindu.com/sci-tech/health/robert-kochs-nobel-prize-winning-discoveries-on-tuberculosis-and-the-foundations-of-bacteriology/article70037275.ece
7,2025,The Hindu,7,"Data supports current U.S. policy of hepatitis B vaccine for newborns, as officials push for change An independent review released on Tuesday by vaccine experts of more than 400 studies and reports found that long-standing U.S. policy of giving the hepatitis B vaccine to newborns has cut infections in children by more than 95%. The policy, adopted in 1991, will be discussed and voted on later this week by Centers for Disease Control and Prevention vaccine advisers hand-picked by U.S. health secretary and anti-vaccine activist Robert F. Kennedy Jr. ""After extensive review, we did not discover safety or effectiveness data that support delaying the choice parents have to vaccinate their newborns against hepatitis B,"" said Michael Osterholm, an infectious-disease expert at the University of Minnesota who helped found the Vaccine Integrity Project that released the review. The Vaccine Integrity Project is an initiative dedicated to safeguarding vaccine use in the United States set up to counter controversial vaccine information and recommendations from the Trump administration that are lacking or contrary to scientific evidence. The revamped CDC advisory panel, following Kennedy's firing of all 17 previous expert members, in September decided to postpone a vote to delay the birth dose of the hepatitis B vaccine.’ Since then, U.S. President Donald Trump and other health officials have called for delaying the first dose of hepatitis B vaccine until as late as age 12, saying that the virus is largely sexually transmitted. Osterholm said the evidence clearly supports keeping the current U.S. policy. Hepatitis B is a liver disease caused by the hepatitis B virus. It primarily spreads through blood, semen, or certain other body fluids. Infants infected with hepatitis B during their first year of life have a 90% chance of developing a chronic infection, increasing the risk of serious liver disease such as cirrhosis or cancer. In a 2024 study reviewed by the Vaccine Integrity Project, the CDC had analysed data on children born between 1994 and 2023 and found that offering the ",,,,https://www.thehindu.com/sci-tech/health/data-supports-current-us-policy-of-hepatitis-b-vaccine-for-newborns-as-officials-push-for-change/article70352955.ece
8,2025,The Hindu,8,"Free legal help through WhatsApp People in the district can seek free legal help through WhatsApp now. They do not have to make any formal application using pen and paper. District Legal Services Authority (DLSA) has launched a unique project named Sahaya Hastham, which will facilitate the people to WhatsApp complaints related to criminal, civil, familial and financial issues to 9188127501. The complaints should have the complete details of the complainant as well as the respondent and their phone numbers. The DLSA will handle the complaints through a hearing to be held at its office functioning at Manjeri Court Complex.",,,,https://www.thehindu.com/news/national/kerala/free-legal-help-through-whatsapp/article70358078.ece
17,2025,The Hindu,17,"Urbanisation, migration contribute to voter roll irregularities: Law Minister Law Minister Arjun Ram Meghwal said on Thursday (December 4, 2025) that rapid urbanisation and frequent migration were the likely causes of irregularities in the voter roll. Mr. Meghwal was responding to Shiv Sena (UBT) MP Sanjay Raut, who asked if the government had taken cognisance of allegations of large-scale voter roll irregularities, including duplicate, deleted and fake entries reported in states like Karnataka, Maharashtra and Bihar. The MP also asked about steps being taken by the Election Commission (EC) to verify, update, and audit electoral rolls to ensure accuracy and prevent manipulation before the upcoming elections. Details were also sought about the verification mechanism to enhance transparency in the voter list revision process and measures being implemented to ensure electoral integrity, data security and accountability of officials involved in voter roll management and election preparedness. In a written reply, Mr. Meghwal said, that according to the EC, significant changes have occurred in the electoral roll over the last 20 years due to additions and deletions on a large scale. “Rapid urbanisation and frequent migration to pursue education, livelihood, and for other reasons, are now a given. Some electors obtain registration in one place and then shift their residence and register themselves at another place without getting their names deleted from the electoral roll of the initial place of residence. This has led to an increased possibility of repeated entries in the electoral roll,” the Minister said. He added that this warranted an intensive verification drive to verify each person before enrolment as an elector. Therefore, the Commission had ordered Special Summary Revision starting from Bihar, which has now been extended to other states. Mr. Meghwal said political parties are being involved in the process, and the electoral roll has been shared at the draft publication and final publication stage. The EC is also inviting claims, and objec",,,,https://www.thehindu.com/news/national/urbanisation-migration-contribute-to-voter-roll-irregularities-law-minister/article70357825.ece
19,2025,The Hindu,19,"Karnataka to develop ‘Digital Heritage Portal’ to preserve cultural legacy Karnataka is advancing its vision to become a national leader in digital heritage preservation with a proposal to create a unified Karnataka Digital Heritage Portal that will integrate manuscripts, rare printed works, archival records and other cultural resources on a single platform. The initiative, led jointly by the Oriental Research Institute (ORI), Mysuru, and the Karnataka State Archives, aligns with the Union government’s Digital India Mission and the National Mission for Manuscripts. Officials said the portal will provide global access to the State’s cultural heritage and strengthen long-term conservation and research. As a key component of the plan, ORI Mysuru is set to house the National Centre for the History of Indian Sciences, further strengthening its role as a premier knowledge repository. The Institute has already embarked on an ambitious programme to digitise its entire collection of palm leaf and paper manuscripts, while also establishing a dedicated website to make rare resources accessible to scholars worldwide. To accelerate digitisation, ORI has entered into an MoU with the Mahabharata Pratishthana, Bengaluru, and is also partnering with the Indira Gandhi National Centre for the Arts (IGNCA), New Delhi. The Institute is upgrading its technology infrastructure to support AI-enabled tools for script recognition, metadata tagging, and digital restoration of damaged materials - an area where initial experiments have shown promising results, officials pointed out. A short audio-visual presentation has already been produced to demonstrate ongoing work and showcase the transformative potential of the digital heritage initiative. Training programmes for digital archivists and expanded digitisation capacity are also part of the broader roadmap. The ORI, Mysuru houses more than 70,000 manuscripts and 45,000 rare printed works, including the Arthashastra, Aryabhatiya, Natya Shastra and Sritattvanidhi. Digitisation projects worth over ₹2.15 crore, undertak",,,,https://www.thehindu.com/news/national/karnataka/karnataka-to-develop-digital-heritage-portal-to-preserve-cultural-legacy/article70357295.ece
1,2025,IEXP,1,Classifying political change: Why not all ‘coups’ are ‘coups’,,,Coup;Express Explained;Sheikh Hasina,https://indianexpress.com/article/explained/classifying-political-change-why-not-all-coups-are-coups-10388320/
2,2025,IEXP,2,"Cyber slavery hubs in Myanmar, Cambodia: How Indians have fallen prey to jobs racket",,,cyber crime;Express Explained,https://indianexpress.com/article/explained/cyber-slavery-hubs-myanmar-cambodia-indian-jobseekers-10397924/
3,2025,IEXP,3,"Who was Major Mohit Sharma, why his family claims ‘Dhurandhar’ is based on him",,,Express Explained,https://indianexpress.com/article/explained/dhurandhar-who-was-major-mohit-sharma-10397847/
4,2025,IEXP,4,"Navy Day 2025: Story of Operation Trident, the 1971 Bangladesh War operation commemorated today",,,1971 India Pakistan War;Express Explained;Indian Navy;navy day,https://indianexpress.com/article/explained/everyday-explainers/navy-day-2025-history-pakistan-war-1971-trident-10401623/
5,2025,IEXP,5,"How China dealt with air pollution, lessons for India",,,air pollution;Express Explained;Express Premium,https://indianexpress.com/article/explained/explained-climate/how-china-dealt-with-air-pollution-lessons-for-india-10371573/
6,2025,IEXP,6,"Explained: Dizzying popularity of Spotify Wrapped, and why it has set off criticism",,,Express Explained;Spotify;Spotify Premium,https://indianexpress.com/article/explained/explained-culture/dizzying-popularity-of-spotify-wrapped-and-why-it-has-set-off-criticism-10401018/
8,2025,IEXP,8,"Weaker against dollar, euro, yen: Why the rupee’s fall is ‘real’ this time",,,Express Explained;Express Premium;rupee,https://indianexpress.com/article/explained/explained-economics/how-the-rupees-fall-is-real-this-time-10395078/
9,2025,IEXP,9,Labour codes: What changes for workers and employers,,,Express Explained;Express Premium,https://indianexpress.com/article/explained/explained-economics/labour-codes-what-changes-for-workers-and-employers-10382411/
10,2025,IEXP,10,Why the RBI MPC is likely to maintain status quo for a third consecutive time,,,Explained Economics;Express Explained;Inflation;monetary policy committee;Reserve Bank of India,https://indianexpress.com/article/explained/explained-economics/mpc-meeting-rbi-status-quo-forecast-impact-10394795/
11,2025,IEXP,11,"Putin’s N-power hard sell: SMRs, new-gen large nuke reactors, serial production in India",,,Explained Economics;Express Explained,https://indianexpress.com/article/explained/explained-economics/putins-n-power-hard-sell-smrs-india-10401462/
12,2025,IEXP,12,Rupee breaches the 90-mark: What’s driving the slide against the dollar,,,Explained Economics;Express Explained;Express Premium,https://indianexpress.com/article/explained/explained-economics/rupee-breaches-90-mark-whats-driving-slide10400171-10400171/
13,2025,IEXP,13,More talent for the market: Why SEBI has made it easier to become an advisor or analyst,,,Explained Economics;Express Explained,https://indianexpress.com/article/explained/explained-economics/sebi-advisor-analyst-10397673/
14,2025,IEXP,14,Stock market’s bull run: What could happen next in a rally led by heavyweights,,,Explained Economics;Express Explained,https://indianexpress.com/article/explained/explained-economics/stock-markets-bull-run-what-next-rally-heavyweights-10399524/
16,2025,IEXP,16,"Explained: Trump’s additional 25% tariff on India brings tariffs on India to 50%, highest tariffs worldwide",,,Explained Economics;Express Explained,https://indianexpress.com/article/explained/explained-economics/trump-additional-25-tariff-india-russian-oil-total-50-10173993/
17,2025,IEXP,17,How 27th Amendment cements Pakistan Army’s stranglehold over power,,,Explained Global;Express Explained,https://indianexpress.com/article/explained/explained-global/27th-amendment-pakistan-army-power-10366081/
19,2025,IEXP,19,China This Week | Roots of Japan-China tensions and row over Arunachal Pradesh woman’s detention,,,China;Explained Global;Express Explained,https://indianexpress.com/article/explained/explained-global/china-this-week-japan-row-trump-call-arunachal-pradesh-10394678/
20,2025,IEXP,20,"China This Week | Taiwan in focus, with row over Japan PM’s comments and sale of US weapons",,,China;Explained Global;Express Explained;Japan;Taiwan,https://indianexpress.com/article/explained/explained-global/china-this-week-taiwan-arms-sales-trump-china-vs-japan-10369522/
23,2025,IEXP,23,National security concerns & Trump’s immigration crackdown,,,donald trump,https://indianexpress.com/article/explained/explained-global/national-security-concerns-trumps-immigration-crackdown-10400984/
25,2025,IEXP,25,"Putin’s visit: The long arc of India’s ties with Russia, the road ahead",,,Express Explained;Express Premium;vladimir putin,https://indianexpress.com/article/explained/explained-global/putins-visit-the-long-arc-of-indias-ties-with-russia-the-road-ahead-10401010/
26,2025,IEXP,26,Trump hints at ending all migration from ‘Third World countries’ to US: All you need to know,,,Explained Global;Express Explained;US President Donald Trump,https://indianexpress.com/article/explained/explained-global/trump-hints-at-ending-all-migration-from-third-world-countries-to-us-all-you-need-to-know-10400403/
28,2025,IEXP,28,What would the United States’ HIRE Act mean for Indian workers if Congress passes it?,,,Explained Global;Express Explained,https://indianexpress.com/article/explained/explained-global/united-states-hire-act-indian-workers-10396172/
32,2025,IEXP,32,"Where Sanchar Saathi stands on user consent, constitutional test on privacy",,,Explained Law;Express Explained,https://indianexpress.com/article/explained/explained-law/where-sanchar-saathi-stands-on-user-consent-constitutional-test-on-privacy-10399165/
35,2025,IEXP,35,Why Cyclone Ditwah caused large-scale damage in Sri Lanka,,,Explained Sci-Tech;Express Explained,https://indianexpress.com/article/explained/explained-sci-tech/cyclone-ditwah-sri-lanka-10398601/
36,2025,IEXP,36,"What is Sanchar Saathi, the app govt has asked smartphone makers to preinstall on all phones",,,Explained Sci-Tech;Express Explained,https://indianexpress.com/article/explained/explained-sci-tech/govt-smartphone-preinstall-sanchar-saathi-what-is-it-10396227/
41,2025,IEXP,41,How the global railway network could back the UN’s sustainable transportation push,,,Express Explained,https://indianexpress.com/article/explained/global-railway-network-un-sustainable-transportation-10397906/
42,2025,IEXP,42,"Surge in GPS jamming and spoofing incidents: How aviation sector is responding to this clear, growing threat",,,aviation;Express Explained,https://indianexpress.com/article/explained/gps-jamming-spoofing-aviation-10399596/
45,2025,IEXP,45,"Nowgam police station blast: What is the SOP for transporting, storing explosives? Experts explain",,,Express Explained;Express Premium,https://indianexpress.com/article/explained/nowgam-police-station-blast-sop-transporting-storing-explosives-10370566/
46,2025,IEXP,46,How show of strength for backward groups offers glimpse into Siddaramaiah-Shivakumar power tussle,,,D K Shivakumar;Express Explained;Karnataka;Siddaramaiah,https://indianexpress.com/article/explained/obc-event-offers-window-into-karnataka-leadership-tussle-10401041/
47,2025,IEXP,47,"Red Fort blast | Former NSG DG explains how IEDs are made, and when they can go off",,,Express Explained;IED;terror,https://indianexpress.com/article/explained/red-fort-blast-ied-nsg-10367327/
49,2025,IEXP,49,Tejas crash: Need for & risks in high-performance  air manoeuvres,,,Dubai;Express Premium,https://indianexpress.com/article/explained/tejas-crash-need-for-risks-in-high-performance-air-manoeuvres-10386103/
50,2025,IEXP,50,"User fee concerns surge at Delhi, Mumbai airports, and the TDSAT order behind it",,,airport;Express Explained,https://indianexpress.com/article/explained/user-fee-delhi-mumbai-airports-tdsat-10397666/
51,2025,IEXP,51,Why UP Gangsters Act was enacted and what led to courts flagging its misuse,,,Express Explained;UP,https://indianexpress.com/article/explained/why-up-gangsters-act-enacted-and-what-led-courts-flagging-misuse-10399245/
52,2025,IEXP,52,"Explained: The problem behind the mass A320 recall by Airbus, its fix, impact on airline operations",,,Airbus;Express Explained,https://indianexpress.com/article/explained/airbus-a320-recall-fix-impact-10393024/
53,2025,IEXP,53,Trump says he will revoke Biden’s executive orders signed by using autopen: Everything you need to know,,,donald trump;Joe Biden,https://indianexpress.com/article/explained/autopen-trump-biden-10392703/
54,2025,IEXP,54,Africa’s forests transformed from carbon sink to carbon source: Why does it matter?,,,Explained Climate;Express Explained,https://indianexpress.com/article/explained/explained-climate/africa-forests-carbon-source-10393218/
55,2025,IEXP,55,‘C-grade’ for India’s national account statistics: IMF evaluation shows India’s new GDP series can’t come fast enough,,,Explained Economics;Express Explained;Express Premium,https://indianexpress.com/article/explained/explained-economics/c-grade-imf-valuation-india-national-account-statistics-10392483/
56,2025,IEXP,56,"Amid China’s chokehold, how India’s Rs 7,280-crore rare earth magnets push seeks some wriggle room",,,Explained Economics;Express Explained;Express Premium;Rare Earths,https://indianexpress.com/article/explained/explained-economics/china-chokehold-india-rs-7280-crore-rare-earth-magnets-push-10394389/
57,2025,IEXP,57,Seven corridors handle 41% of India’s rail traffic: How Railways plans to expand them,,,Express Explained,https://indianexpress.com/article/explained/explained-economics/india-rail-traffic-high-density-network-indian-railways-10394087/
58,2025,IEXP,58,"Why Netanyahu wants presidential pardon for graft charges he denied, and what happens now",,,Explained Global;Express Explained,https://indianexpress.com/article/explained/explained-global/netanyahu-president-pardon-cases-against-him-what-next-10394760/
59,2025,IEXP,59,How SC brought down curtains on Sterling Group bank fraud case,,,supreme court,https://indianexpress.com/article/explained/explained-law/how-sc-brought-down-curtains-on-sterling-group-bank-fraud-case-10393207/
60,2025,IEXP,60,Why a new govt directive means your WhatsApp Web could soon log you out every 6 hours,,,Explained Sci-Tech;Express Explained;Whatsapp,https://indianexpress.com/article/explained/explained-sci-tech/whatsapp-web-automatic-log-out-six-hourse-reason-10394142/
61,2025,IEXP,61,Why is Iran boycotting the 2026 FIFA World Cup draw in the United States next week?,,,Explained Sport;Express Explained,https://indianexpress.com/article/explained/explained-sports/iran-2026-fifa-world-cup-draw-10393501/
62,2025,IEXP,62,"Higher penalty, regulating quality for sale and import – What the new Seeds Bill proposes",,,Express Explained,https://indianexpress.com/article/explained/higher-penalty-regulating-quality-for-sale-and-import-what-the-new-seeds-bill-proposes-10393339/
63,2025,IEXP,63,The ubiquitous YKK Zipper will change for the first time in 100 years. Here is what to know,,,Express Explained,https://indianexpress.com/article/explained/ykk-zipper-change-100-years-10393157/
64,2025,IEXP,64,Explained: Inside the Punjab protests against Centre’s new power law,,,Electricity (Amendment) Bill;Express Explained,https://indianexpress.com/article/explained/everyday-explainers/inside-punjab-protests-against-centres-new-power-law-concerns-about-cherry-picking-consumers-eroding-subsidies-10389175/
65,2025,IEXP,65,"Sensex’s 1000-point rally: How it reached all-time high, and why it’s set for a bull run",,,Bombay Stock Exchange (BSE);BSE Sensex;Everyday Explainers;Express Explained;Indian stock market,https://indianexpress.com/article/explained/everyday-explainers/sensexs-1000-point-rally-how-it-happened-and-why-its-all-set-for-a-bull-run-10387453/
66,2025,IEXP,66,"How the rise of AI songs, including on music charts, is creating a sense of unease",,,artificial intelligence;Explained Culture;Express Explained,https://indianexpress.com/article/explained/explained-culture/ai-music-unease-impact-artists-charts-10390911/
67,2025,IEXP,67,GDP: New labour codes and opportunity for India’s weakest states,,,Explained Economics;Express Explained,https://indianexpress.com/article/explained/explained-economics/labour-codes-india-weakest-states-10391054/
68,2025,IEXP,68,Rupee rebounds from historic lows: What is supporting the currency?,,,Explained Economics;Express Explained,https://indianexpress.com/article/explained/explained-economics/rupee-rebound-historic-low-10385633/
69,2025,IEXP,69,"The 14-month tortuous journey for Sensex from 85,000 to 86,000, how it played out",,,Explained Economics;Express Explained,https://indianexpress.com/article/explained/explained-economics/sensex-journey-86000-how-played-out-10389096/
70,2025,IEXP,70,Sensex and Nifty are touching record highs. Why is your MF portfolio not mirroring that rise?,,,Explained Economics;Express Explained;Express Premium;mutual fund;Sensex,https://indianexpress.com/article/explained/explained-economics/sensex-nifty-record-highs-impact-mutual-funds-10391053/
71,2025,IEXP,71,"Explained: Amid deadly Hong Kong fire incident, the role of bamboo scaffolding",,,Bamboo;Explained Global;Express Explained;Hong Kong,https://indianexpress.com/article/explained/explained-global/hong-kong-fire-incident-reason-factors-bamboo-10389553/
